nom_journal,date,contenu
FIGARO,04/07/2024,"Page 73 of 141 © 2025 Factiva, Inc. Tous droits réservés.
LE FIGARO Politique
Bellamy balaie la « rumeur » d'une participation à un gouvernement RN
Emmanuel Galiero; egaliero@tvmag.com
658 mots
4 juillet 2024
Le Figaro
FIGARO
A
5
24840
Français
(c) Copyright 2024 Le Figaro.
Le député LR européen refuse de se laisser « instrumentaliser » par le parti nationaliste.
Je ne me laisserai pas instrumentaliser   ; je suis libre et je ne suis en rien candidat pour entrer dans un
gouvernement. » François-Xavier Bellamy veut tordre le cou à la rumeur. Si le parti de Marine Le Pen
parvenait à obtenir une majorité absolue dimanche, à l'issue du second tour des élections législatives, le
député LR européen n'accepterait aucun portefeuille ministériel. «  Je n'ai absolument pas été contacté, ni
directement ni indirectement. En vérité, je ne suis pas dupe, je vois bien ce qui se joue dans ces rumeurs
soigneusement organisées... Déjà, avant les élections européennes, Jordan Bardella laissait entendre que je
serais sur sa liste.  »
Les LR historiques, opposés à Éric Ciotti dans son alliance avec le Rassemblement national, refusent de
choisir entre le parti de Bardella et le Nouveau Front populaire. Ils ne donnent aucune consigne de vote entre
les deux tours de scrutin et s'en remettent à la libre « conscience » des électeurs. Bellamy maintient, lui, la
ligne qu'il avait portée dans la campagne européenne. «  Je ne crois pas qu'il faille céder à la panique, au
contraire   ; dans ce moment de confusion, il est plus nécessaire que jamais de défendre notre ligne, notre
identité et nos convictions, celles qui gagnent partout en Europe  », assure le suppléant d'Arnaud Poulain
dans la 1 re  circonscription des Yvelines, partisan d'une droite autonome et indépendante. 
Conscient des jeux d'alliances qui agitent l'entre-deux-tours et lucide sur le fait que plusieurs candidats de
droite sauveront leur siège grâce aux retraits de la gauche, le parlementaire assure qu'«  aucune transaction,
aucune négociation, aucune manoeuvre d'appareil  » n'ont été engagées côté LR. Ce cap lui semble d'autant
plus pertinent aujourd'hui au moment de «  l'incroyable revirement  » de la macronie, prête à pactiser avec la
gauche, y compris radicale. «  Comment les Français peuvent-ils admettre que le camp macroniste soutienne
désormais Louis Boyard, qui organisait le blocage des universités, Benoît Biteau qui justifiait la violence à
Sainte-Soline, ou David Guiraud, qui assume sa proximité avec un antisémitisme décomplexé   ? Surtout
quand c'est pour imposer l'injustifiable, comme le camp macroniste qui, en s'alignant avec La France
insoumise, montre qu'il pratique un «front républicain» à géométrie variable... C'est révoltant.  »
Parallèlement, il exprime de fortes réserves à l'égard du RN, «  sans porter de jugement moral  ». Pour lui, le
parti de Marine Le Pen a toujours été le «  meilleur instrument de la gauche  ». «  J'aimerais rappeler que
dans le second tour qui confrontait François Hollande à Nicolas Sarkozy, Marine Le   Pen avait prôné le vote
blanc  ». Aujourd'hui, la candidature de l'ancien président en Corrèze est au centre des problématiques de la
droite. Éric Ciotti, toujours président des LR, demande au candidat LR de se retirer au profit d'une candidate
RN arrivée en 2 e  position au premier tour. La demande est jugée inacceptable et le candidat socialiste a de
grandes chances d'en profiter. «  Je le maintiens   : la réponse la plus efficace contre cette improbable
coalition qui voit un ancien président socialiste faire cause commune avec un antifa fiché S, c'est d'assumer
nos convictions, pas de déserter le terrain.  » Il ne partage pas le pari d'Éric Ciotti. Refusant de pratiquer le « 
en même temps  » qui a fait souffrir LR, il interroge cette «   promesse de l'union des droites au moment où
Marine Le Pen affirme que le RN n'est pas de droite  ». Puis, à la veille d'une élection cruciale pour l'avenir
du pays et de sa famille politique, François-Xavier Bellamy confie une dernière inquiétude : «  Ma crainte est
que la crise que nous traversons ne s'arrêtera pas le 8   juillet.  » ET E.G.
1082.0.191294815
Document FIGARO0020240704ek740000h
"
FIGARO,04/07/2024,"Page 71 of 141 © 2025 Factiva, Inc. Tous droits réservés.
LE FIGARO Société
Les forces de l'ordre se préparent à de possibles désordres post-électoraux
Jean-Marc Leclerc; jmleclerc@lefigaro.fr
1,005 mots
4 juillet 2024
Le Figaro
FIGARO
A
13
24840
Français
(c) Copyright 2024 Le Figaro.
La perspective de grandes manifestations, doublées de violences urbaines, en pleins JO, inquiète les
policiers et les gendarmes, déjà sursollicités jusqu'à Nouméa.
La perspective de tensions dans la rue, attisées par l'extrême gauche, si le RN devait concrétiser sa percée
au second tour des élections législatives, le 7 juillet prochain, n'est pas prise à la légère par les forces de
l'ordre. Le ministère de l'Intérieur se trouve, pour l'heure, dans la délicate situation de devoir gérer les affaires
courantes, en attendant que la situation politique se décante.
Partout dans les casernes et les commissariats, fonctionnaires et militaires ont intégré qu'il faudrait attendre
la formation d'un nouveau gouvernement pour y voir plus clair sur les choix sécuritaires du pays. Et la
perspective d'un exécutif bicéphale qui se disputerait, entre l'Élysée et Matignon, les commandes de
l'appareil régalien, en cas de cohabitation, n'est pas pour rassurer.
Alors, les policiers et les gendarmes - qui attendent la nomination imminente de leurs nouveaux directeurs
généraux respectifs - s'accrochent à leur savoir-faire pour affronter les difficultés à venir, à commencer donc
par les inévitables problèmes d'ordre public, dès la proclamation des résultats dimanche.
«   Cette configuration est bien sûr dans l'esprit de tous. Sa potentielle simultanéité avec les Jeux olympiques
peut interroger, d'autant qu'une partie non négligeable de forces mobiles est engagée en Nouvelle-Calédonie
» , prévient Fabien Vanhemelryck, le secrétaire général du syndicat de police Alliance (majoritaire chez les
gradés et gardiens).
«   Nous avons toujours été en capacité de faire face aux défis sécuritaires, en priorisant les missions » ,
reprend ce syndicaliste écouté qui espère aussi que de «   possibles tensions post-électorales n'aient pas
vocation à durer très longtemps » .
Entre les prévisibles manifestations contre l'extrême droite dans les grandes villes et le spectre de nouvelles
émeutes un peu partout en France, comme en juin dernier, les professionnels de la sécurité à Beauvau
n'ignorent pas, en tout cas, que divers scenarii peuvent se combiner.
«   Avec 35 unités des forces mobiles bloquées à Nouméa, il faudra que les choses ne s'enveniment pas trop
en métropole pour espérer garder le contrôle » , constate cliniquement un cadre d'une compagnie
républicaine de sécurité (CRS) de l'est de la France.
À l'été 2023, la mort du jeune Nahel, victime d'un tir d'un policier lors d'une intervention routière, avait été le
catalyseur d'un mouvement de colère sans précédent. «   Un fait divers peut tout embraser, c'est vrai, surtout
lorsque le climat est si inflammable » , convient un chef de police de la petite couronne parisienne.
Déjà, dans les banlieues, circulent de véritables appels à la haine dans des morceaux de rappeurs très
populaires, réunis en collectif contre le RN. «   L'extrême gauche a toujours rêvé de faire la jonction des
luttes, mais n'y est jamais parvenue, même si elle s'est montrée très présente lors des événements de juin
2023 » , nuance un chef de circonscription de police des Hauts-de-Seine. Il dit cependant observer «   avec
une certaine inquiétude » l'émergence de ces deux France «   face à face » dont parlait l'ancien premier flic
de France, Gérard Collomb, dans son testament politique.
Fronde sociale envisagée
Page 72 of 141 © 2025 Factiva, Inc. Tous droits réservés.
«   Pour ce qui est des habituelles manifestations de la gauche radicale, il faut s'attendre à voir s'agiter les
villes généralement à la pointe de ce type de contestation, comme Nantes, Toulouse ou Bordeaux » , spécule
un affilié du Syndicat indépendant des commissaires de police (SICP).
La séquence qui s'ouvre peut-elle aboutir à la résurrection d'une forme de fronde sociale récurrente, à la
manière des «gilets jaunes » ? «   Trop tôt pour le dire, mais rien n'est à exclure » , admet le préfet d'un
département rural. Lui est davantage concentré sur les menaces «   au jour le jour »  : «   Ici, on craint moins
les violences urbaines que des actions isolées de militants de l'union de la gauche sur du mobilier urbain, des
permanences électorales ou des voitures d'élus du RN. On s'y prépare, il faudra encore plus de présence sur
la voie publique pendant quelque temps » , déclare-t-il.
Un membre du Syndicat des commissaires de la police nationale (SCPN, majoritaire) en convient : «   Si le
RN obtient une majorité absolue dimanche, il y aura forcément des réactions épidermiques, de la casse, des
pillages et des grandes manifestations. Ce n'est pas faire de la politique-fiction que de s'y préparer, c'est
notre métier » , dit-il.
Les chefs de police sont également mobilisés sur d'autres dates : les 13 et 14 juillet, toujours très agités en
France et qui peuvent servir de défouloir. «   D'ordinaire, le 15 juillet, tout s'arrête et les Français partent en
vacances, y compris ceux des quartiers populaires issus de l'immigration maghrébine, qui repartent voir la
famille au pays, quelques semaines, voire quelques mois. » Ce sont, à ses yeux, des «   facteurs apaisants »
. Dans les commissariats de la capitale et des villes concernées par les JO, beaucoup redoutent malgré tout
une forme d'épuisement des personnels. «   On nous avait demandé de renoncer aux congés pendant les
Jeux et, finalement, on nous explique que tout le monde compte surtout sur nous après, à cause du contexte
politique. Nous prendrait-on pour une simple variable d'ajustement ? » , ironise un syndicaliste de
l'Unsa-Police.
Gaëlle James, la patronne de Synergie-Officiers, résume : «   On a toujours été là pour assurer l'ordre public.
Quelle que soit la configuration politique le 7 juillet au soir, nous savons que ce sera compliqué, mais le
timing n'est pas bon, ça tout le monde en a conscience. »
Les forces de sécurité nationales entrent dans une zone de turbulences au pire moment, quand les caméras
du monde entier seront braquées sur le pays, devenu terre olympique. Cette dissolution n'a décidément pas
fini de produire ses effets. J.-M. L.
1082.0.189375352
Document FIGARO0020240704ek740000y
"
FIGARO,04/07/2024,"Page 70 of 141 © 2025 Factiva, Inc. Tous droits réservés.
FIGARO ECONOMIE Une-ECO
La dissolution pèse sur l'activité du privé
284 mots
4 juillet 2024
Le Figaro
FIGARO
C
21
24840
Français
(c) Copyright 2024 Le Figaro.
FOCUS FOCUS
L'incertitude liée aux élections législatives pèse sur l'activité de l'économie française. Le secteur privé a
enregistré «   une légère contraction » en juin, ont indiqué mercredi le cabinet S&P Global et la Hamburg
Commercial Bank (HCOB). L'indice PMI composite de l'activité globale «   s'est marginalement replié » par
rapport à mai, passant de 48,9 à 48,8 - un indice inférieur à 50 signalant une contraction.
La détérioration de la demande se traduit par une baisse de quatre points sur le mois de l'indice des
nouvelles affaires, qui s'est replié à son plus bas niveau depuis cinq mois. Les nouveaux contrats ont reculé
tant dans l'industrie manufacturière que dans les services. En outre, la contraction du volume des affaires en
cours a accéléré, celles-ci enregistrant leur plus fort recul depuis janvier.
Enfin, la confiance des entreprises du secteur privé français sur la croissance de leur activité dans l'année à
venir s'est repliée à son plus bas niveau depuis quatre mois. «   Certaines entreprises interrogées ont attribué
la détérioration de la conjoncture du secteur au manque de visibilité créé par l'annonce des élections, ce que
semble par ailleurs confirmer le recul soudain des nouvelles affaires au cours du mois » , observe Norman
Liebke, économiste à la HCOB.
«   Les élections ont en outre pesé sur l'optimisme des prestataires de services français, les perspectives
d'activité à douze mois s'étant en effet repliées à un plus bas de cinq mois et ayant affiché un niveau
nettement inférieur à leur moyenne de long terme » , a-t-il ajouté. J. R. P.
1082.0.189603438
Document FIGARO0020240704ek7400014
"
FIGARO,04/07/2024,"Page 68 of 141 © 2025 Factiva, Inc. Tous droits réservés.
LE FIGARO Politique
Édouard Philippe votera pour les communistes au Havre, tout en les excluant d'un accord
Loris Boichot; lboichot@lefigaro.fr
721 mots
4 juillet 2024
Le Figaro
FIGARO
A
3
24840
Français
(c) Copyright 2024 Le Figaro.
La règle d'Édouard Philippe, ni Rassemblement national (RN) ni La France insoumise (LFI), épargne les
communistes. Dimanche, pour le second tour des élections législatives, le maire du Havre votera pour son
opposant local Jean-Paul Lecoq, député PCF sortant, arrivé en tête au premier tour (42,82 % des voix) face à
la candidate du RN, Isabelle Le Coz (31,32 %), dans la 8 e  circonscription de Seine-Maritime.
«   Je voterai pour un communiste dimanche prochain. Sans hésiter, car je préfère un élu avec lequel j'ai des
désaccords, mais avec qui je peux travailler, qu'un candidat avec qui j'ai des désaccords de nature » , a-t-il
expliqué mardi à Paris devant Le Figaro , en marge d'un déplacement en soutien à la ministre candidate
Olivia Grégoire (Entreprises).
L'ex-premier ministre assume de longue date ce vote d'un scrutin à l'autre, dès qu'un second tour oppose le
Parti communiste français au RN. Tout comme d'ailleurs le numéro trois du gouvernement sortant Gérald
Darmanin, et le président LR des Hauts-de-France Xavier Bertrand. Édouard Philippe avait déjà réaffirmé
cette position en septembre dernier, à la Fête de l'Humanité, lors d'un débat avec le dirigeant communiste
Fabien Roussel. Mercredi, la double finaliste de la présidentielle Marine Le Pen, a fustigé cette attitude : «  
La classe politique donne d'elle-même une image de plus en plus grotesque » , a-t-elle écrit sur X.
Pour Édouard Philippe, en plus de la droite libérale et conservatrice anti-RN, une partie de la gauche doit
aussi bénéficier d'un signal d'ouverture envoyé par le «   bloc central » . Mais pas les Insoumis, ce qui le
distingue de la ligne exprimée par Gabriel Attal et Emmanuel Macron. Dès dimanche soir, le premier ministre
a jugé prioritaire de lutter contre le projet «   funeste du RN » , afin de l' «   empêcher » d'obtenir une majorité
à l'Assemblée nationale. Au point d'encourager au retrait d'Albane Branlant dans la Somme, où elle s'est
désistée pour permettre l'élection de François Ruffin ; et de pousser au maintien de Loïc Signor dans le
Val-de-Marne, où sa présence doit garantir l'élection de Louis Boyard en privant le RN d'un report de voix
potentiel.
« Espace politique central »
«   J'ai du mal à dire qu'on peut faire un front républicain (...) avec un parti présidé par M. Mélenchon, qui me
paraît très en dehors d'un certain nombre de règles démocratiques et qui accepte en son sein (...) des gens
qui jouent avec tous les codes de l'antisémitisme, qui proposent de tout conflictualiser en dehors du débat
démocratique » , a insisté mardi Édouard Philippe. Conscient que sa position «   peut irriter certains » à
gauche et dans l'aile sociale-démocrate du camp Macron, qui l'accusent de mettre sur le même plan LFI et le
parti nationaliste, il prévient qu'il «   ne renoncera pas à (ses) idées parce qu'elles ne plaisent pas à tous » .
Après l'affaissement du camp présidentiel au premier tour des élections législatives dimanche dernier, le
président du parti Horizons veut toujours tendre la main à sa gauche et à sa droite. Qui plus est au moment
où revient le scénario d'une grande coalition, dans le cas où l'Assemblée ne disposerait pas d'une majorité
claire à l'issue du second tour. Mais, en dépit de son vote personnel, Édouard Philippe estime que les
communistes seraient, tout comme les Insoumis, exclus d'un éventuel accord parlementaire, qu'il imagine
aller «   de la droite conservatrice aux socio-démocrates ». Pas au-delà.
«   Il y a un espace politique central de gens qui refusent la mainmise du Rassemblement national ou de La
France insoumise, mais il n'est pas structuré de façon à travailler ensemble. Il y a besoin de structuration, de
travail d'écoute » , déclare-t-il au Figaro . Reste enfin la question de l'organisation de son camp, alors que la
dissolution surprise décidée par Emmanuel Macron a «   tué la majorité présidentielle » selon lui. Dans une
courte allocution, dimanche soir, il a prévenu : «   Tout est à reconstruire du côté de la droite et du centre. J'y
suis prêt. » L. B.
Page 69 of 141 © 2025 Factiva, Inc. Tous droits réservés.
1082.0.189743345
Document FIGARO0020240704ek740001k
"
FIGARO,04/07/2024,"Page 66 of 141 © 2025 Factiva, Inc. Tous droits réservés.
LE FIGARO Politique
En Corse, les nationalistes en difficulté face au score inédit du RN
Antoine Giannini; agiannini@lefigaro.fr
981 mots
4 juillet 2024
Le Figaro
FIGARO
A
7
24840
Français
(c) Copyright 2024 Le Figaro.
La vague du Rassemblement national a aussi touché la Corse, dans des proportions insoupçonnées : le
mouvement à la flamme est parvenu à hisser trois candidats au second tour des élections législatives, dans
les quatre circonscriptions de l'île. Il est loin le temps où Jean-Marie Le Pen, en février 2002, était empêché
par les nationalistes d'atterrir à Bastia puis interdit de meeting à Ajaccio. Vingt-deux ans plus tard, l'extrême
droite fait jeu égal avec les nationalistes, qui comptent pourtant trois députés sortants.
Jusque-là, la Corse faisait figure d'ovni dans le paysage politique français. Jamais un candidat du RN n'était
parvenu à atteindre le second tour des élections législatives dans l'île, malgré des percées significatives à
la présidentielle ou aux européennes : «   C'est un coup de tonnerre que nous allons avoir du mal à encaisser
» , confie un cadre du mouvement Femu a Corsica, à la tête de la région depuis 2015. Dans les colonnes de
Corse-Matin, Gilles Simeoni, président autonomiste de la collectivité de Corse, analyse amèrement cette
première défaite politique depuis 2014 : «  T rois candidats que personne ne connaît et qui ne connaissent
rien de la Corse sont tout de même parvenus à faire d'énormes scores. Cela veut dire que le corps électoral
et la Corse ont changé. Il faut tirer des conséquences sur notre façon d'expliquer notre projet politique, notre
rapport aux Corses et à la société corse.   »
C'est l'autre réalité de ces élections. Sur les quatre candidats du RN, trois n'ont quasiment aucun ancrage
dans l'île. Ce qui n'a pas empêché le parti de Marine Le Pen d'engranger environ 46 000 voix sur 248 000
inscrits pour 154 000 votants, soit un fort taux de participation. De l'autre côté, la majorité territoriale récolte
environ 40 000 voix au soir du premier tour, alors que les indépendantistes de Core in Fronte atteignent près
de 7600 voix. De quoi rebattre complètement les cartes électorales, dans un territoire où les électeurs avaient
l'habitude de voter pour un nom plutôt qu'un parti.
En Corse-du-Sud, Ariane Quarena-Natali (31,2 %), inconnue en politique, devance d'une courte tête le
président des députés Horizons, Laurent Marcangeli (30,7 %), sur ses terres ajacciennes. De son côté, le
délégué territorial du RN, François Filoni (35,1 %) laisse loin derrière lui le député nationaliste sortant,
Paul-André Colombani (26,4 %). En Haute-Corse, l'autonomiste Michel Castellani (31,7 %) est talonné par
Jean-Michel Marchal (28,8 %), dans une circonscription où la ville de Bastia est tenue depuis 2014 par les
nationalistes. Le RN y a plus que doublé son score.
Dans la deuxième circonscription, l'autonomiste Jean-Félix Acquaviva est en grande difficulté. Avec 28,6 %
des voix, le député sortant, qui appartient au premier cercle de Gilles Simeoni, est battu par le divers droite
François-Xavier Ceccoli (34,1 %). La candidate RN Sylvie Jouart (25,4 %, soit 11 points de plus qu'en 2022)
s'est désistée «   devant l'appel du Nouveau Front populaire et du président de l'exécutif de Corse à faire
barrage aux candidats du RN présents au second tour de l'élection législative », précise un communiqué du
RN François Filoni. Dans le viseur, les attaques de Gilles Simeoni qualifiant, en meeting à Bastia, le parti de
Jordan Bardella d' «   ennemi du peuple corse ».
Une première secousse avait eu lieu en 2022, lors de la présidentielle. Marine Le Pen avait recueilli 58 % des
voix au second tour, soit son meilleur score en France. Trois de ses candidats avaient terminé la course en
troisième position, aux portes du second tour, lors des législatives la même année. Aux dernières élections
européennes, Jordan Bardella avait fait carton plein sur l'île, avec 40,8 % des voix, soit 9 points de plus que
la moyenne nationale.
Dans une forme de déni, les nationalistes parlent d'un vote « continental ». Mais la réalité du terrain est plus
complexe : «   J'ai voté Simeoni à toutes les élections, mais là je ne crois plus dans sa politique, analyse un
militant nationaliste qui dit avoir voté RN. J'ai confiance en leur capacité de répondre aux problématiques de
pouvoir d'achat, d'insécurité, d'accession à la propriété ou d'immigration.   »
Page 67 of 141 © 2025 Factiva, Inc. Tous droits réservés.
Une critique de l'action des autonomistes, en difficulté au moment de faire le bilan de près de dix années de
mandature à la tête de la région. Une forme d'usure du pouvoir aussi, alors que Gilles Simeoni a tout misé
sur le processus d'autonomie engagé par le gouvernement, quitte à se rapprocher d'Emmanuel Macron dans
le cadre des discussions. De quoi susciter les critiques, jusque dans son propre camp.
Certains n'hésitent plus à parler d'un « processus enterré vivant » par les scores du RN au niveau national, le
parti étant fortement opposé à l'autonomie de la Corse. Jordan Bardella redoutait même que cette réforme
constitutionnelle constitue le «   marchepied de l'indépendance ».
Gérald Darmanin, le ministre de l'Intérieur, s'était engagé en mars 2022 à discuter de l'avenir de l'île, jusqu'à
une potentielle autonomie, quatre mois après l'agression mortelle en prison du militant indépendantiste corse
Yvan Colonna, condamné à perpétuité pour l'assassinat du préfet Claude Erignac. Des violentes
manifestations avaient alors éclaté sur l'île. Emmanuel Macron avait aussi acté cette réforme
constitutionnelle, en septembre 2023, devant l'Assemblée de Corse.
Ces discussions semblent presque oubliées, à l'approche d'un second tour sous tension. «   Dimanche, un
choix de société s'offre à nous. Voter pour ou contre la Corse », lance Paul-André Colombani. En toile de
fond pour les nationalistes, empêcher le RN de s'enraciner sur l'échiquier politique insulaire. A.G.
1082.0.190650512
Document FIGARO0020240704ek7400022
"
