nom_journal,date,contenu
FIGARO,02/07/2024,"Page 95 of 141 © 2025 Factiva, Inc. Tous droits réservés.
LE FIGARO Politique
« Le «front républicain» peut se réactiver, mais dans une version très dégradée »
Célestine Gentilhomme; cgentilhomme@lefigaro.fr
839 mots
2 juillet 2024
Le Figaro
FIGARO
A
4
24838
Français
(c) Copyright 2024 Le Figaro.
LE FIGARO. - LE FIGARO. - Quels enseignements peut-on tirer de ce premier tour ?
 -  MATHIEU GALLARD. - On assiste à une confirmation du rapport de force des élections européennes avec
un Rassemblement national (RN) et ses alliés en très bonne position. Derrière, la gauche reste assez stable
élection après élection depuis 2017, sans vraiment avoir de « dynamique ». Le Nouveau Front populaire
réussit néanmoins à créer l'unité, ce qui n'était pas forcément gagné, avec des électeurs de gauche qui
restent fidèles. Il y a ensuite la troisième place du camp présidentiel, pour lequel cette élection est très
difficile. Mais en passant de 14,6 % à plus de 20 % (20,04 %), la macronie sauve sa place dans ce système
de tripartition de la vie politique, alors qu'on la disait menacée par un possible retour de la bipartition.
Finalement, le bloc central existe toujours et aura un rôle important pour former une majorité alternative, dans
le cas où aucune majorité absolue ne se dégage le 7 juillet. 
LE FIGARO. - Dans quel panorama s'engage ce second tour, marqué par un nombre record de
triangulaires ?
 - On voit beaucoup plus de triangulaires (306) que de duels (190) à l'issue du premier tour. Sur le papier,
c'est une très bonne nouvelle pour le Rassemblement national et ses alliés, même s'ils obtiennent un résultat
un peu en deçà des européennes. Mais tout risque de se compliquer à partir de mardi soir (date à laquelle
les candidatures doivent être déposées pour le second tour, NDLR) , puisqu'il y aura beaucoup de
désistements notamment à gauche. 
LE FIGARO. - Chaque camp a livré ses consignes de vote. Les Français vont-ils suivre les demandes des
états-majors ?
 - Les Français ne suivent pas aveuglément les consignes de vote. Mais lorsqu'elles sont émises de manière
claire, cohérente et rapide par l'ensemble des dirigeants d'un bloc - notamment à gauche -, c'est un vrai
signal qui est envoyé aux électeurs. Cela peut avoir un impact non négligeable sur les dynamiques de report
de voix, notamment venues de la gauche. Dans le camp macroniste, il y a eu beaucoup de confusion, des
consignes très différentes d'un dirigeant à l'autre. Dans ce cas-là, les effets de ces appels sont plus douteux.
LE FIGARO. - Le « front républicain » pour faire « barrage » au RN peut-il encore fonctionner ?
 - C'est une idée qui s'est effondrée lors des élections législatives de 2022. À l'élection présidentielle, ce
« front républicain » avait quand même fonctionné, puisque Emmanuel Macron avait été élu avec 58 % des
voix. Le barrage était déjà très dégradé, mais il fonctionnait encore dans un moment où personne n'imaginait
que le RN puisse un jour prendre le pouvoir. Cette fois, le contexte est complètement différent. On peut faire
l'hypothèse qu'il puisse se réactiver sur une version qui soit, une fois de plus, très dégradée. Il suffit de
quelques reports de voix supplémentaires pour que des dizaines de circonscriptions promises au RN lui
échappent. 
LE FIGARO. - Dans ce cas, la majorité absolue est-elle encore atteignable pour la formation de Marine
Le Pen ?
 - Ce n'est pas totalement exclu. Mais la majorité absolue pour le RN et ses alliés semble aujourd'hui
nettement moins crédible qu'avant le premier tour. Ces derniers ont obtenu un score un peu en deçà des
attentes : dans des dizaines de circonscriptions, leurs candidats sont dans des positions moins favorables.
De même, les désistements républicains sont très handicapants pour ce bloc. Pour l'instant, deux scénarios
sont plus probables. Le premier serait celui d'une majorité certes relative, mais quand même solide (entre
260-270 sièges), qui ferait du RN et de ses alliés des acteurs incontournables pour gouverner. Le second
Page 96 of 141 © 2025 Factiva, Inc. Tous droits réservés.
serait celui d'une majorité relative beaucoup plus faible (entre 220 et 240 députés), qui ouvrirait la possibilité
de majorités techniques alternatives des Verts aux LR, en passant par les socialistes. Ce serait peut-être
simplement pour soutenir un gouvernement technique qui ne ferait pas de grandes réformes et s'occuperait
des affaires courantes jusqu'à une éventuelle prochaine dissolution d'ici un an. 
LE FIGARO. - Si aucune majorité absolue ne se dégage, une « crise de régime » est-elle inévitable au
lendemain du 7 juillet ?
 - Dans tous les pays d'Europe, il n'y a jamais de majorité absolue sans que cela ne les empêche de très bien
fonctionner. Il n'y aurait donc pas forcément de blocage total. La question est plutôt de savoir si l'un des
partis appartenant aux trois blocs accepte de faire des compromis. Les institutions françaises sont faites pour
une certaine verticalité du pouvoir, ce qui ne facilite pas les attitudes de compromis. Le scrutin uninominal à
deux tours sert davantage à dégager des majorités absolues, en mobilisant sa base. Ce sont nos institutions
qui peuvent en réalité devenir bloquantes. 
M athieu Gallard est directeur d'études à Ipsos France.  
1082.0.156321102
Document FIGARO0020240702ek720002a
"
FIGARO,02/07/2024,"Page 93 of 141 © 2025 Factiva, Inc. Tous droits réservés.
LE FIGARO Politique
Les Républicains poursuivent leur stratégie d'indépendance
Emmanuel Galiero; egaliero@tvmag.com
1,158 mots
2 juillet 2024
Le Figaro
FIGARO
A
4
24838
Français
(c) Copyright 2024 Le Figaro.
Entre « fermeté » et « responsabilité », la droite tente de faire campagne en ciblant à la fois le RN et LFI.
Au lendemain du premier tour des élections législatives, Les Républicains maintiennent officiellement le
cap d'une droite «   de fermeté, de liberté et de responsabilité ». Motivés par l'ambition de construire une
alternative, ils rejettent les deux options du RN et de l'extrême gauche, refusent de donner la moindre
consigne de vote en vue du second tour et misent sur la libre «   conscience » des électeurs pour apprécier la
situation.
«   On a bien résisté », lâche Annie Genevard, la numéro deux des Républicains. Après le premier round, ce
soupir de soulagement cache une réalité plus délicate. Car parmi les députés sortants, seuls quinze issus du
canal historique de la droite sont en tête. Quand une écrasante majorité de ceux qui se sont qualifiés au
second tour se retrouvent en opposition frontale avec un candidat du Rassemblement national. «   La vague
en plein visage », commente, inquiet, un élu. La droite accuse le coup sans être totalement sonnée par l'onde
de choc du parti lepéniste qui, allié à Éric Ciotti, sécurise entre 240 et 270 sièges.
« Séisme électoral »
Numériquement, cependant, la victoire revient à celui qui est encore président des Républicains. Son alliance
avec le Rassemblement national a affaibli son ancienne famille politique, dans des territoires historiquement
marqués à droite. Dans les Alpes-Maritimes, par exemple, la députée sortante Christelle D'Intorni a été élue
dès le premier tour dans la 5 e  circonscription. Dans le Tarn, Guilhem Carayon, président des Jeunes LR,
s'est qualifié avec 43,5 % des voix et se dit «   très confiant » pour la suite. Chez les ciottistes, on compte sur
les discussions d'entre-deux-tours jusqu'à la dernière minute (mardi, 18 heures) pour attirer des élus LR vers
la «   coalition » avec le RN. «   Les choses vont bouger. On va élargir. Les discussions qui étaient en pause
depuis la décision d'Éric Ciotti ont repris. Beaucoup s'interrogent et réfléchissent. Nous les appelons au bon
sens s'ils veulent combattre l'extrême gauche », confie un partenaire du président des LR.
Dans ce camp-là de la droite, on estime que les ténors LR ne sont pas en excellente posture. On les juge «  
soit sur fil du rasoir, soit en situation d'être battus ». Et, par ailleurs, on ne croit pas à l'impact des consignes
de vote venues de la gauche. «   La politique du castor (qui construit un barrage, NDLR) , ça ne marche plus.
Les électeurs sont libres et ne sont pas dupes   », juge-t-on dans l'entourage d'Éric Ciotti, où l'on veut croire à
la possibilité de construire une majorité absolue avec le RN et tous ceux qui «   refuseront de plonger la
France dans une période d'instabilité ».
La droite LR poursuit néanmoins sa stratégie d'indépendance, refusant de donner des consignes de vote.
Dans un communiqué, le parti se félicite de s'être «   courageusement battu », et ce, «   sans faire d'alliance
contre-nature, pour proposer une alternative » portée par une «   droite républicaine et indépendante ». Le
mouvement cible «   les outrances d'une extrême gauche dominée par LFI » tout comme le Rassemblement
national, qui «   n'est pas non plus une solution pour la France car son programme démagogique entraînera
le chaos et l'appauvrissement de notre pays ».
En Île-de-France, Valérie Pécresse qualifie ce premier tour de «   séisme électoral ». « La dissolution
insensée du président Macron restera dans les annales de l'aveuglement politique et de l'impuissance à
répondre efficacement aux urgences du pays », accuse-t-elle, avant de lancer un appel au ni RN-ni LFI en
vue du second tour : «   J'exhorte les Français à rejeter les extrêmes. Le projet du Rassemblement national
entraînerait désordre et faillite. Celui du Nouveau Front populaire, soumis à La France insoumise
provoquerait la décomposition de la République. Pour cela, tous les électeurs qui ont la République chevillée
au coeur doivent se mobiliser », prévient l'ex-candidate à la présidentielle. Partout où les candidats de la «  
Page 94 of 141 © 2025 Factiva, Inc. Tous droits réservés.
droite républicaine » ne sont pas en mesure de se maintenir, ou ont choisi de se retirer, elle soutiendra ceux
qui «   se battent contre la montée du RN et de LFI » .
Une ligne de crête difficile à tenir et qui, sur le plan local, risque d'être «   inopérante », de l'aveu même d'un
cadre. Dans la 1 re  circonscription du Haut-Rhin, par exemple, le député sortant Raphaël Schellenberger est
en ballottage et n'a qu' «   un adversaire » au second tour : une candidate du RN. Cet autre élu s'interroge
sur l' «   efficacité » du «   ni-ni » officiellement adopté par le parti. «   Mais quelle est l'autre solution ? C'est
une élection où les gens choisissent qui va composer un gouvernement, et nous, on n'a pas d'incarnation
nationale. On est trop faibles. » Pierre-Henri Dumont, qualifié au second tour avec 33,75 % des voix contre
un candidat du RN, en tête avec 47,86 % des voix, s'interroge. «   Chacun gère les consignes de vote, qu'on
laisse chacun se débrouiller », lance l'élu LR. Sur la question du parti lepéniste, «   j'ai toujours été très ferme
sur mon opposition » : « La droite républicaine, par rapport à son histoire, ne peut pas s'allier. C'est, de façon
générale, une erreur d'analyse et irrationnel que de penser que le RN peut apporter quelque chose au pays.
»
« Un parti sans idéologie »
En adoptant le « ni-ni », LR refuse de fait la notion d' «   arc républicain » avancé par la gauche - et
notamment par François Hollande, arrivé en tête dans sa circonscription corrézienne. «   C'est la dérive d'un
parti sans idéologie, sans chef, et qui n'a pas su renouveler ses idées et ses cadres », fustige un élu de
droite. Il n'empêche, nombreux sont les sortants LR à avoir une chance d'être élus grâce aux désistements
des candidats du Nouveau Front populaire. La droite pourrait donc, en quelque sorte, et dans certains
territoires, être sauvée par cette gauche qu'elle dénonce tant depuis le début de la campagne des
législatives...
Le cas de Laurent Wauquiez est, en ce sens, éloquent : la candidate écologiste s'est désistée en Haute-Loire
pour faire barrage au RN. «   En républicaine et en application des directives nationales d'EELV, je me
désiste du second tour, mais jamais je n'appellerai à voter pour Laurent Wauquiez, a déclaré Celline Gacon.
J'appelle M.   Wauquiez à se distinguer à l'Assemblée nationale par rapport aux positions de l'extrême droite.
» Annie Genevard, prise dans une triangulaire où s'affrontent le RN et le Nouveau Front populaire, pourrait
largement bénéficier du retrait de la gauche. «   On en appelle aux électeurs, balaie-t-elle. Les appareils sont
libres de faire les opérations qu'ils veulent . » Reste à savoir ce qu'en pensent les Français sur le terrain. ET
E.G.
1082.0.155484727
Document FIGARO0020240702ek720002h
"
FIGARO,02/07/2024,"Page 87 of 141 © 2025 Factiva, Inc. Tous droits réservés.
LE FIGARO Opinions
L'inquiétante progression de l'anathème en Occident
Renaud Girard; rgirard@lefigaro.fr
1,197 mots
2 juillet 2024
Le Figaro
FIGARO
A
19
24838
Français
(c) Copyright 2024 Le Figaro.
CHRONIQUE
FIGAROVOX/CHRONIQUE - Aux États-Unis comme chez nous, la politique semble désormais consister à
jeter l'anathème sur son adversaire plutôt qu'à débattre avec lui. Le débat public n'en sort pas grandi.
Après avoir regardé à la télévision, à moins de trois jours d'écart, le face-à-face américain Trump- Biden du
jeudi 27 juin 2024 et la soirée électorale française du dimanche 30 juin, j'ai été frappé par un phénomène,
pour moi nouveau : l'extrême pauvreté du débat politique chez les Occidentaux.
J'ai eu l'impression qu'on avait, à mon insu, changé d'ère politique en Occident. J'ai eu le sentiment qu'on
était passé, en relativement peu de temps, d'une démocratie fondée sur le débat constructif - qu'il ait lieu
dans une enceinte parlementaire ou sur un plateau de télévision - à une foire d'empoigne, où les anathèmes
avaient remplacé les arguments.
Sans remonter à l'élégance des débats cruciaux des années 1970, comme les face-à-face Mitterrand-Giscard
d'Estaing de 1974 ou Carter-Ford de 1976, la démocratie délibérative se portait encore bien au début du XXI
e  siècle. Les débats Sarkozy-Royal de 2007 ou Obama-McCain de 2008 furent de bonne tenue. On y
assista, dans le calme, à de réels échanges d'arguments, fondés sur les programmes respectifs des
candidats.
Lors du débat Biden-Trump, on entendit surtout fuser les insultes. Dans mon florilège, j'ai recueilli les termes
de criminel, menteur, pleurnicheur, looser, chat de gouttière.
Plus grave encore, la politique moderne semble désormais consister à jeter l'anathème sur son adversaire
plutôt qu'a débattre avec lui. La priorité de l'homme politique moderne ne semble plus être de convaincre un
auditoire que son programme est meilleur pour le pays que celui de son adversaire. Il s'agit bien plutôt
d'excommunier son adversaire, de le chasser du champ politique du débat démocratique. En Amérique, on
appelle cela la « cancel culture ». Celui qui n'est pas d'accord avec vous n'a tout simplement plus voix au
chapitre.
Les démocrates ont jeté l'anathème sur Donald Trump en disant qu'il mettait en péril la démocratie
américaine.
Au début de son mandat présidentiel, ils avaient même essayé de le destituer sous le prétexte qu'il aurait été
un espion, « tenu » par le Kremlin. L'« information » provenait d'un ex-agent secret britannique au passé
douteux. Il a fallu une longue enquête du Washington Post (journal pourtant démocrate) pour prouver que
c'était complètement bidon. 
Aujourd'hui, les démocrates prétendent que Trump serait séditieux, à cause de la manifestation de ses
partisans du 6 janvier 2021 à Washington, où la foule réussit à envahir le Capitole. C'est oublier
l'incompétence crasse de la police du Congrès - en France, la police n'a jamais laissé les « gilets jaunes »
pénétrer au Sénat, ni à l'Assemblée, ni à Matignon, ni à l'Élysée. C'est oublier aussi que Trump appela dans
un tweet ses partisans à manifester «   peacefully and patriotically ». Héritier de Lincoln, le Parti républicain
américain est une grande institution de la démocratie américaine. Il est ridicule de prétendre qu'il serait
devenu une organisation séditieuse.
À l'inverse, les républicains usent de l'anathème en prétendant que le président démocrate actuel serait
gâteux. Certes, Joe Biden a souvent des absences lors de ses apparitions publiques. Mais le coeur du métier
Page 88 of 141 © 2025 Factiva, Inc. Tous droits réservés.
de président des États-Unis n'est pas d'être un bonimenteur de foire. C'est de concevoir une bonne politique
et de parvenir à la faire exécuter.
Force est de constater que Joe Biden a remarquablement réussi à protéger les intérêts de son pays au cours
des trois ans et demi pendant lesquels il l'a dirigé. En économie, il a créé 800 000 emplois industriels ; il a fait
revenir sur le sol américain nombre de productions stratégiques (comme les microprocesseurs) ; il a obtenu
du Congrès une loi de subventions massives aux industries combattant le changement climatique (Inflation
Reduction Act d'août 2022), qui fait que les investisseurs du monde entier se précipitent aujourd'hui aux
États-Unis. Depuis cinquante ans, jamais l'écart de richesse entre les Européens et les Américains n'a été
aussi grand, en faveur de ces derniers.
En politique étrangère, il a réussi à empêcher la Russie de s'emparer de l'Ukraine ; il a ramené deux États
supplémentaires importants dans l'Otan (la Suède et la Finlande) ; il a vassalisé comme jamais les
Européens, dans les secteurs de l'énergie comme de l'armement.
Son seul échec se trouve à la frontière avec le Mexique, où il n'est pas parvenu à endiguer l'immigration
illégale. Certes, Biden semble un peu trop âgé pour exercer les fonctions harassantes de président des
États-Unis. Mais souvenons-nous que le chancelier Adenauer avait 87 ans lorsqu'il signa à Paris, en janvier
1963, le traité de l'Élysée, lequel régit toujours les relations franco-allemandes. Biden est sûrement trop vieux
pour les tournées de cirque de la politique spectacle. Mais est-il trop vieux pour la politique au sens noble du
terme ? Rien ne nous le prouve.
En France, la politique est, hélas, aussi gagnée par la pratique de l'anathème. On a lu des patrons de
journaux, pourtant jadis d'une gauche raisonnable, nous expliquer que nous risquions, à la faveur de ces
élections législatives, de voir notre démocratie « dénaturée » et notre nation « déshonorée ». Allons,
allons... Ce moment démocratique n'était peut-être pas nécessaire, mais il n'a rien de déshonorant, au
contraire.
Au lieu de pratiquer l'anathème contre le Rassemblement national, de crier au loup fasciste, pourquoi la
macronie et la gauche ne cherchent-elles pas à répondre à la demande exprimée par l'électorat pour
davantage d'ordre dans nos rues, à nos frontières, dans nos écoles, dans nos finances publiques ? Pourquoi
ne le défient-elles pas calmement le RN sur son programme économique ? Nous expliquer que Bardella est
un nouveau Mussolini relève de la politique de l'anathème.
À l'inverse, il est ridicule de résumer l'idéologie du Nouveau Front populaire à de l'islamo-gauchisme. Certes,
certains de ses membres expriment un antisémitisme fétide ; certes, il est invraisemblable de ne pas
condamner le pogrom ignoble du 7 octobre 2023. Mais de là à jeter l'opprobre sur tout un mouvement... Je
pense que les idées économiques du NFP sont folles et mèneraient la France à sa ruine, mais je préfère
débattre calmement avec les militants du NFP plutôt que de jeter sur eux l'anathème. Je ne partage pas les
idées de MM. Ruffin et Roussel, mais je pense que ce sont des hommes politiques tout à fait respectables, et
je ne jetterai jamais sur eux l'anathème d'« islamo-gauchistes ».
La démocratie moderne a été inventée par les Anglais, avec ses débats civilisés à la Chambre des
communes, sa presse libre et ouverte à toutes les opinions, son respect de l'adversaire. Il est grand temps
qu'on y revienne en Occident. R. G.
1082.0.156527275
Document FIGARO0020240702ek720002q
"
