nom_journal,date,contenu
FIGARO,06/07/2024,"Page 23 of 141 © 2025 Factiva, Inc. Tous droits réservés.
LE FIGARO Politique
Tiraillés, Les Républicains se voient en force pivot à l'Assemblée
Emmanuel Galiero; egaliero@tvmag.com
1,487 mots
6 juillet 2024
Le Figaro
FIGARO
A
6
24842
Français
(c) Copyright 2024 Le Figaro.
Divisés à la veille du second tour des législatives, les pro et anti-Ciotti s'interrogent mais anticipent une
recomposition de la droite.
Une fracture et un espoir. Les Républicains abordent le second tour des élections législatives dans une
atmosphère plombée par la violence de leurs déchirures internes, mais consolés par l'hypothèse du rôle pivot
que pourrait avoir la droite au sein de la nouvelle Assemblée nationale. «  Mais attention, ce n'est pas parce
qu'on est un groupe pivot qu'il faut nous prendre pour un gond  », prévient un cadre. Numériquement, Les
Républicains craignent de perdre des plumes dimanche parmi leurs 62 parlementaires sortants tandis que, à
la veille du scrutin final, dans lequel il reste 76 « purs LR » engagés, les dernières estimations de l'enquête
Ifop-Fiducial pour LCI les situent dans une fourchette comprise entre 50 et 65 sièges. Une projection qui ne
compte pas les probables victoires chez les 57 candidats investis sous les couleurs d'Éric Ciotti/RN se
croyant en capacité d'atteindre le minimum requis de 15 députés pour créer un groupe.
L'image fait un peu désordre, mais si ces deux scénarios étaient confirmés, la droite pourrait alors
revendiquer un poids politique dans l'Hémicycle, alors que, vendredi, la probabilité d'une majorité absolue
pour le parti de Marine Le Pen était jugée plutôt faible. «  Si c'est le destin de notre groupe parlementaire, la
même question reviendra toujours   : à qui tu apportes ta voix ? À la majorité improbable regroupant les
débris du macronisme, la gauche et les écolos ? Ou au RN ? Dans les deux cas, le message politique de la
droite est brouillé... On en a déjà payé le prix sous la précédente législature  », souffle un ténor. «  À 40-45,
vous pouvez avoir de l'influence, bien sûr. Mais vous ne faites pas une majorité. Vous faites du cas par cas,
texte par texte. Mais vous n'êtes pas une puissance déterminante.  »
Pris de court par la décision personnelle d'Éric Ciotti d'engager LR dans une alliance avec le RN, les ténors
du parti ont fait corps autour de Laurent Wauquiez pour tenter de démonétiser celui qui est encore à la tête
du parti. Dans l'urgence, ils ont annoncé publiquement son exclusion de la présidence et du mouvement,
mais trois offensives juridiques lancées pour clarifier les choses avant le premier tour se sont révélées
vaines. Et, jusqu'au bout du scrutin, le chef de la droite aura défendu son fauteuil et ses prérogatives comme
si de rien n'était. «  Le parti, je ne sais plus ce que c'est...  », souffle un sénateur LR. «  Et on n'en a pas fini
avec Ciotti. On attend le jugement qui ne viendra qu'en octobre. À un moment où l'époque est à la
recomposition politique et à la clarification, où des négociations vont s'enclencher entre tous les partis, ce
n'est quand même pas l'idéal...  »
« À qui profitera le report de voix ? »
Parallèlement, les LR se sont fait la guerre dans les circonscriptions où nombre de leurs candidats se
trouvent en compétition dimanche avec autant de rivaux RN. Lancé dans sa logique d'union nationale, Éric
Ciotti a même parfois demandé à certains LR de se retirer au profit du RN, comme il l'a fait en Corrèze (sans
y parvenir) dans la circonscription où l'ex-président socialiste François Hollande est arrivé en tête au premier
tour.
Au-delà de la puissante vague RN à laquelle LR est confronté au coeur même de leurs bastions, comme
c'est le cas dans les Alpes-Maritimes ou encore à Dreux, où Olivier Marleix joue gros sur ses terres, la droite
est aussi confrontée à la double question des alliances et des désistements. Indignés face aux virages
tactiques d'Emmanuel Macron et de Gabriel Attal vers un Nouveau Front populaire fortement teinté de
mélenchonisme, les élus ont exprimé leurs interrogations au sein des groupes LR, que ce soit à l'Assemblée
ou au Sénat. «  La question, c'est   : à qui profitera le report de voix ? Les électeurs suivront-ils vraiment les
consignes de vote pour faire barrage au RN ?  », interroge un ténor LR. Un sénateur s'émeut : «  J'entends le
premier ministre appeler à faire barrage au RN à tout prix. Mais moi, même pour un empire, je ne donne pas
mon vote à LFI qui est beaucoup plus dangereux pour le pays   ! Et puis, au nom de quoi ? Les macronistes
Page 24 of 141 © 2025 Factiva, Inc. Tous droits réservés.
rêvent d'une grande compotée composée d'écolos, d'UDI et de LR... Mais j'attends de voir. Ça ne tiendra
pas. Ce sera de la gestion courante.  » Un cadre poursuit : «  Gérard Larcher pousse dans le sens d'une
grande coalition fantasmée...  ». Créant quelques tensions du côté de la droite sénatoriale, entre ceux «  qui
refusent la compromission et ceux qui suivent encore le macronisme  », siffle-t-on, regrettant la récente
rencontre du président du Sénat avec Emmanuel Macron. «  Aller à l'Élysée avant le second tour... C'est
bizarre. On n'a pas besoin de ça  », s'offusque un parlementaire, alors que Gérard Larcher avait pourtant
accepté l'entretien en soulignant sa volonté de s'en tenir strictement aux questions institutionnelles. En cas
de démission du chef de l'État, chacun sait que l'hôte du Palais du Luxembourg aurait la lourde charge
d'assurer l'intérim en attendant une élection présidentielle. Cela poserait mécaniquement la droite sous la
lumière. «  Rien n'est à exclure  », glisse un sénateur LR.
La ligne officielle des anti-ciottistes, celle d'une droite indépendante et autonome, s'est trouvée fragilisée par
l'irruption, durant l'entre-deux-tours, d'un «  axe Macron-Mélenchon  ». Et parallèlement, tous les candidats
LR qui pourront peut-être sauver leur peau dans les territoires où la gauche a annoncé son retrait pour faire
barrage au RN, se retrouvent dans une position politique inconfortable à l'égard de leurs électeurs, révulsés
par l'emprise de la gauche radicale. Dans le Doubs, le candidat du NFP, éliminé au premier tour, a par
exemple appelé ses électeurs à glisser un bulletin LR pour empêcher la victoire du RN. «  Il peut faire les
déclarations qu'il veut, je n'ai absolument rien de commun avec LFI. Les électeurs de la 5 e circonscription du
Doubs me connaissent et ils se détermineront sur mon travail et mes convictions  », a répliqué la candidate
de droite et secrétaire générale des Républicains, Annie Genevard.
Après avoir déjà résisté aux assauts du macronisme depuis sept ans, plusieurs LR veulent croire qu'ils
pourront récolter une nouvelle fois les fruits de leur ancrage et la confiance d'un électorat fidèle. Ils le font en
rappelant la réalité de l'implantation de la droite en France où ils restent à la tête de nombreuses villes et
collectivités locales, qu'elles soient départementales ou régionales. Ils rappellent aussi l'importance de leur
majorité de droite au Sénat où le président Gérard Larcher et le chef de groupe Bruno Retailleau font valoir le
poids politique d'une opposition parlementaire qui se dit prête à bâtir une «  alternative  » au macronisme « 
brouillon et finissant  ». De fait, ces élections législatives provoquées par une dissolution, à laquelle pas
une seule figure de la droite n'avait voulu croire, ont brutalement accéléré le calendrier des LR, à commencer
par celui de Laurent Wauquiez qui a senti la nécessité de s'engager dans la bataille en Haute-Loire. 
Visions divergentes
Arrivé en tête au premier tour dans la 1 re  circonscription, talonné par une candidature RN, le président de la
région Auvergne-Rhône-Alpes, aborde la seconde manche concentré, mais sans doute rassuré aussi par le
désistement d'une candidate écologiste arrivée troisième. La victoire de Laurent Wauquiez, si elle advient,
est espérée par certains à droite. Elle serait complète si les LR évitaient un affaiblissement numérique au
Parlement. Le symbole et le chiffre, en quelque sorte. «  Cela nous donnerait une nouvelle visibilité, surtout
s'il prenait la présidence du groupe.  » Un ténor nuance : «  Je crois qu'il vise plutôt la présidence du parti...
Mais cela envoie-t-il un signal de renouveau alors que nous nous trouvons dans une immense vague de
dégagisme   ?  »
Dans le brouillard de ces législatives impromptues, pour lesquelles il reste 501 sièges à pourvoir au second
tour, se dessinent déjà les prochains débats d'une famille politique cernée par les questions. Les
Républicains étaient entrés dans le match avec des visions divergentes sur la manière de sauver la droite.
Autour de Wauquiez, l'on croit pouvoir rebondir sur l'indépendance. Avec Éric Ciotti, l'on s'imagine à la veille
d'une grande «  union nationale  ». Seule certitude pour dimanche soir : dans l'océan des sensibilités LR et
dans un climat prévisible de grande instabilité parlementaire, chacun se comptera avant d'envisager la suite. 
ET E.G.
1082.0.222252513
Document FIGARO0020240706ek760000w
"
FIGARO,06/07/2024,"Page 14 of 141 © 2025 Factiva, Inc. Tous droits réservés.
LE FIGARO Politique
Sous le blocage politique, le risque d'un recul du pays
Guillaume Tabard; gtabard@lefigaro.fr
619 mots
6 juillet 2024
Le Figaro
FIGARO
A
3
24842
Français
(c) Copyright 2024 Le Figaro.
CHRONIQUE CONTRE-POINT
Imaginons. Nous sommes le vendredi 5 juillet 2024. La France s'apprête à jouer les quarts de finale de l'Euro
et les Français, toutes sensibilités confondues, vibrent au diapason d'une équipe dont les joueurs ne
cherchent pas à faire de la politique mais à marquer des buts. Nous ne sommes plus qu'à trois semaines de
la cérémonie d'ouverture des Jeux olympiques de Paris. Les embarras des préparatifs s'estompent et c'est
un pays progressivement gagné par l'enthousiasme et la fierté qui s'apprête, sous le regard du monde, à
vivre un moment de ferveur nationale comme l'histoire lui en offre rarement.
Imaginons ce mois de juillet sans dissolution. Mais par l'incroyable décision d'Emmanuel Macron, c'est une
nation non pas réconciliée mais fracturée qui se donne à voir. Non pas mobilisée mais à bout de souffle. Non
pas prête à un nouveau départ, mais menacée de se retrouver à l'arrêt. Non pas confiante mais plus inquiète
que jamais. Comment en serait-il autrement ?
Si le Rassemblement national emporte clairement ces élections législatives, toute une partie du pays
devant qui on a agité le chiffon rouge d'un retour de Vichy se sentira investie du devoir d'entrer en sécession,
en résistance, en désobéissance, voire de s'opposer par la violence au verdict des urnes. Un groupe
antifasciste n'appelle-t-il pas déjà à «   converger vers l'Assemblée nationale » dimanche soir ? Si son
avance est trop courte et qu'une improbable coalition patchwork se met en place, ce sont les électeurs de la
première force politique du pays qui auront le sentiment de se faire voler leur victoire.
Le scénario annoncé par les dernières projections est tout aussi inquiétant. Une majorité insuffisante pour le
RN conjuguée à l'absence de toute majorité alternative n'annoncerait rien de moins qu'un blocage
institutionnel. Aucun gouvernement ne pourrait agir, le président ne pourrait pas dissoudre l'Assemblée avant
un an. Cette impasse politique se doublerait d'une colère compréhensible dans le pays et d'un
affaiblissement accru de la France en Europe et dans le monde. On voit mal dans un tel contexte comment la
question d'une démission d'Emmanuel Macron puisse être éludée. Ce qui prolongerait de plusieurs mois
encore la crise politique.
Une majorité absolue pour le RN pourrait donc passer pour le meilleur gage de stabilité institutionnelle ; à
condition que le président défait et le premier ministre nommé trouvent les règles d'un fonctionnement, sinon
harmonieux, du moins respectueux. Mais aux conséquences politiques redoutées s'ajoutent les
conséquences économiques pour la vie du pays. Faut-il rappeler que c'est pour conjurer une censure
annoncée sur le prochain budget que Macron a anticipé la dissolution ? Et que ce budget obligeait à trouver
quelque 20 milliards d'économies. Or le programme du RN et plus encore celui du Nouveau Front populaire,
loin de prévoir des économies, se caractérisent par des dizaines de milliards d'euros de dépenses nouvelles.
Les niveaux des déficits et de la dette, faisant déjà de la France l'homme malade de l'Europe, atteindraient
des niveaux insupportables. Et si la majorité sortante parvenait à se maintenir dans le cadre d'une coalition
nouvelle, le piteux abandon de la réforme de l'assurance-chômage par Gabriel Attal annonce déjà qu'elle
renoncera à toute politique de redressement des comptes publics. Même à supposer qu'Emmanuel Macron
échappe au blocage politique, il portera la responsabilité d'une incapacité de la France à se redresser et à se
réformer. G. T.
1082.0.222138932
Document FIGARO0020240706ek760000z
"
FIGARO,06/07/2024,"Page 1 of 141 © 2025 Factiva, Inc. Tous droits réservés.
LE FIGARO Politique
La majorité de Macron en passe de devenir « minorité présidentielle »
Tristan Quinault-Maupoil; tquinault@lefigaro.fr
1,364 mots
6 juillet 2024
Le Figaro
FIGARO
A
2
24842
Français
(c) Copyright 2024 Le Figaro.
I  l y a mille options sur la table, tout dépend des rapports de force.  » Dans l'entourage d'Emmanuel Macron,
on reste forcément flou sur les scénarios envisagés au lendemain du second tour des élections législatives.
Une hypothèse tient cependant la corde depuis plusieurs jours : celle d'un maintien lundi de Gabriel Attal et
son équipe, même démissionnaire, le temps de dégager une solution politique. 
Quoi qu'il en soit, le président de la République devrait voir s'envoler dimanche soir l'essentiel de ses leviers
de commande. «  Macron n'a pas compris que le pouvoir ne sera plus à l'Élysée mais au Parlement, donc
qu'il donnera aux députés les clés du pays  », glisse un soutien du premier ministre, alors que les relations
sont plus délétères que jamais entre les deux têtes de l'exécutif.
De fait, une «  option  » est pour le coup d'ores et déjà exclue en macronie : celle de garder une majorité,
même relative, à l'Assemblée nationale. Habitués à deux reprises à aborder les élections législatives en
position de favoris, les macronistes se préparent pour la première fois à devenir la « minorité
présidentielle ». 
Un véritable basculement dans la jeune histoire du camp Macron, au terme d'une campagne en forme de
supplice, marquée dans ses derniers jours par l'agression à Meudon-la-Forêt (Hauts-de-Seine) de militants
proches de la porte-parole du gouvernement, Prisca Thevenot. «  Il y a un anti-macronisme terrible  », a
raconté le député sortant Jean-Pierre Pont, après sa défaite dès le premier tour dans son fief du
Pas-de-Calais. «  M. Macron m'a fait élire député, puis il m'a fait perdre la députation  », a-t-il résumé. À
l'image de l'élu de 74 ans, beaucoup de soutiens du chef de l'État ne lui pardonnent pas sa dissolution
surprise et solitaire.
Déjà absents d'une centaine de circonscriptions avant le premier tour pour favoriser d'éventuels partenaires,
les représentants du camp présidentiel ont encore réduit leur espace dans l'entre-deux-tours, après leur
échec dimanche (21 % des voix). Environ 80 candidats se sont désistés au nom du « barrage » contre le RN.
La gauche aussi a largement joué le jeu, retirant ses candidats face des adversaires pourtant honnis comme
Élisabeth Borne dans le Calvados ou Gérald Darmanin dans le Nord. 
«  Les désistements et l'implantation vont permettre à des élus de se sauver  », souffle-t-on rue du Rocher, à
Paris, au quartier général de campagne. Mais quelques-uns redoutent un effet contre-productif, avec le
spectre d'une entente contre-nature qui viendrait gonfler encore les voiles du RN. «  Les Français ont voulu
300 triangulaires, mais dix mecs à Paris ont décidé qu'il y en aurait moins de 100 , grince un familier de
l'Élysée. La population doit se sentir cocue un peu partout.  »
Reste un effacement douloureux : seuls 236 candidats du camp Macron et « divers centre » se maintiennent
en lice, contre quelque 400 en 2022 et environ 500 en 2017. Gabriel Attal a fini par l'admettre : «  Nos
candidats ne sont pas en capacité de former seuls une majorité absolue à l'Assemblée.  » Il en est fini de la
coalition parlementaire composée de Renaissance, du Mouvement démocrate (MoDem) et d'Horizons,
composantes de la majorité relative. Il n'est plus question de donner au chef de l'État le pouvoir de gouverner
les mains libres, lui qui affirmait encore au Figaro Magazine , au lendemain de la dissolution : «  J'y vais pour
gagner   !  »
Page 2 of 141 © 2025 Factiva, Inc. Tous droits réservés.
Les macronistes sont loin de leurs premiers pas à l'Assemblée, à l'été 2017, quand 350 élus d'une majorité
pléthorique, pour beaucoup sélectionnés sur CV dans la « société civile », arrivèrent dans l'Hémicycle la fleur
au fusil. Volontiers qualifiés d'arrogants par leurs opposants, ils promettaient avec ferveur de mettre en place
de nouvelles pratiques, certains ne jugeant pas nécessaire d'ouvrir une permanence parlementaire.
Sept ans plus tard, les plus implantés dans leur circonscription espèrent y être réélus dimanche. Sans
certitude. Certains se lassaient déjà d'être députés d'une majorité relative et craignent de ne pas
s'accoutumer à un nouveau statut d'opposant, dont ils ignorent tout. Sans compter ceux qui ne se font pas à
l'idée de devoir éventuellement voter des motions de censure. «  Pas d'opposition stérile, ça ne sert à rien.
On verra texte par texte  », assure d'avance l'ex-ministre Philippe Vigier, candidat à sa réélection à
Châteaudun (Eure-et-Loir).
«  C'est la fin d'une époque  », admet auprès de ses proches François Bayrou, qui décèle toutefois dans ce
bouleversement politique «  une possibilité de régénération  ». Comprendre : une très incertaine « coalition
des modérés », rassemblant les parlementaires à l'exclusion des Insoumis et des lepénistes, pour gouverner
le pays. Un pis-aller auquel se raccroche le centriste, tout comme Yaël Braun-Pivet, Édouard Philippe et
Gabriel Attal, qui laisse infuser l'idée d'un pouvoir donné à une «  Assemblée plurielle  ».
Le chef de la majorité sortante fait partie de ces poids lourds qui attendent d'être fixés sur leur sort. «  J'irai
toujours là où je me sentirai utile à mon pays. Quelles que soient les configurations  », prévient Gabriel Attal,
qui, du cabinet de la socialiste Marisol Touraine en 2012 jusqu'à Matignon aujourd'hui, a toujours évolué au
coeur du pouvoir.
Pour lui comme pour ses collègues au gouvernement, la dissolution a balayé les plans qui commençaient à
s'esquisser pour 2027. Auréolés d'une forte longévité à leur poste, Bruno Le Maire à Bercy, Gérald Darmanin
à l'Intérieur ou Éric Dupond-Moretti à la Justice vont devoir se réinventer en se retrouvant probablement dans
l'opposition. Certains dans le chaudron du Parlement s'ils sont réélus dimanche, d'autres à l'extérieur en
repartant d'une page blanche. 
Pour la première fois depuis 2007, le ministre de l'Économie ne sera bientôt plus titulaire d'aucune charge ou
mandat. Le garde des Sceaux, qui a pourtant pris goût à la politique, quittera le pouvoir sans avoir trouvé
l'occasion de préparer une implantation locale. Sébastien Lecornu, ministre depuis sept ans, retrouvera le
Sénat et son fief de l'Eure où le RN devient hégémonique. 
Ceux qui avaient les yeux braqués vers les élections municipales reconsidèreront-ils leurs plans après la
déroute électorale ? Les ministres Sabrina Agresti-Roubache à Marseille, Fadila Khattabi à Dijon et Patricia
Mirallès à Montpellier, arrivées troisième dimanche et poussées à se retirer, se retrouvent sans mandat... De
mauvais augure avant le scrutin de 2026.
Dans ce collectif qui se disloque, un risque se fait jour. Celui d'un camp présidentiel émancipé d'Emmanuel
Macron, éclaté sous la pression de sa gauche et de sa droite. «  Si le président avait créé un parti fort, on ne
serait pas dans ce désastre  », estime un cadre de Renaissance. Les récentes divisions en interne sur le
périmètre du « front républicain » - certains se contentant d'en exclure le RN quand d'autres rejettent aussi
LFI - ont déjà réveillé le clivage droite-gauche en macronie. 
Le congrès du parti présidentiel Renaissance, attendu à l'automne, pourrait mettre en lumière cet
affrontement de lignes. À moins que certains prennent la poudre d'escampette d'ici-là. Gérald Darmanin
regarde déjà vers Horizons, le parti d'Édouard Philippe, avec lequel il veut bâtir une force politique de droite.
«  On sera attractifs, on sera un réceptacle  », veut croire la députée (Horizons) sortante Naïma Moutchou,
candidate dans le Val-d'Oise.
Pour se rassurer, certains s'imaginent le destin des députés de droite en 1997. Laminés par le chaos de la
dissolution ratée, ils sont revenus en force à l'Assemblée nationale cinq ans plus tard, dans la foulée de
l'élection présidentielle. «  Les dynamiques peuvent s'inverser très vite  », garantit le député sortant
(Renaissance) Marc Ferracci. Mais le RPR d'hier s'était mis dans la roue d'un candidat incontesté, Jacques
Chirac, pour renaître dans l'Hémicycle. Alors qu'Emmanuel Macron, lui, est empêché par la Constitution de
se représenter. L.B. ET L.H. ET T.Q.-M.
1082.0.222207631
Document FIGARO0020240706ek7600013
"
