nom_journal,date,contenu
EXPRSS,20/06/2024,"Page 119 of 198 © 2025 Factiva, Inc. Tous droits réservés.
News; France POLITIQUE
COULISSES; Impréparation, isolement... Macron gagné par la peur
LAURELINE DUPONT ÉRIC MANDONNET
1,702 mots
20 juin 2024
L'Express
EXPRSS
28
3807
Français
Copyright 2024 L'Express - All rights reserved
Alors que le président a prononcé la dissolution de l'Assemblée nationale, un vent de panique souffle sur
l'Elysée. Récit exclusif.
EXTÉRIEUR JOUR G7, ITALIE JEUDI 13 JUIN
Sous l'olivier, des embrassades, puis la main d'Emmanuel Macron chaleureusement posée sur le dos de
Giorgia Meloni. A quoi songe-t-il, ce président ? L'idée qu'il contemple peut-être son futur lui traverse-t-elle
l'esprit quand il sourit à la présidente du Conseil italien, issue des rangs de la droite extrême ? Quand les
sollicitations faiblissent, il s'empare de son téléphone : « Je suis au G7, tiens-moi au courant par écrit de ce
qui se passe. »
INTÉRIEUR JOUR PARIS, ÉLYSÉE ET ALENTOUR JEUDI 13 JUIN
Devant les vidéos venues d'Italie, un stratège du chef de l'Etat écarquille les yeux. « Ici, il faut combattre la
peste brune ; là-bas, c'est accolades et fous rires avec la blonde ? » Y aurait-il un doute sur la stratégie
présidentielle ? Ding ! L'image s'interrompt, la réflexion avec. SMS du président. Le tenir au courant ? Bien
sûr, mais faut-il lui dire qu'ici tout est chaos ? Vertige.
A l'Elysée, ce qui frappe, c'est ce bruit de fond qui, depuis l'arrivée de Jonathan Guémas, plume devenue
conseiller spécial, avait disparu. Voilà belle lurette que la télévision accrochée au mur de son bureau ne
parlait plus. Depuis le séisme, BFM vingt-quatre heures sur vingt-quatre dans le cadre blanc, et, face à lui,
des yeux rougis de déchiffrer sans répit les bandeaux successifs, tout en imaginant, à la hâte, un plan pour
rebondir. On se persuade que Paris et la presse sont des bulles déconnectées. La preuve, cette carte
saisissante, il est vrai des résultats du scrutin européen par bureau de vote dans la capitale, Raphaël
Glucksmann premier, Valérie Hayer deuxième, Manon Aubry troisième, et Jordan Bardella grand dernier :
seuls trois bureaux parisiens l'ont placé en tête.
Au parti, à l'Assemblée, au gouvernement, chez les amis d'hier et d'aujourd'hui, cette volonté d'un « retour au
peuple » intrigue, quand elle n'afflige pas franchement. Commentaire le plus sobre glané auprès d'un
macroniste de la première heure : « Je suis préoccupé et triste. » Conclusion d'un autre : « Quelle que soit
l'issue du scrutin, la Ve est totalement déglinguée, le paysage politique est en ruine et le jeu est animé par les
extrêmes. Je suis écoeuré. » Faut-il dire tout cela au chef de l'Etat ?
EXTÉRIEUR JOUR OMAHA BEACH FLASH-BACK JEUDI 6 JUIN
Le président commémore tandis que, au loin, Alexis Kohler bavarde. Le secrétaire général de l'Elysée quitte
rarement la rue du Faubourg-Saint-Honoré et il savourerait pleinement l'instant s'il n'était pas depuis
quelques heures le réceptacle des réprobations et des questionnements inquiets. Depuis le matin, il a
commencé à distiller l'idée d'un coup politique inédit, en cas de mauvais score pour la majorité. « La coalition,
ça ne vole pas, comment voulez-vous qu'on s'allie avec des gens qui ne veulent pas nous aider, confie-t-il à
ses interlocuteurs. Il n'y a que la dissolution, c'est le moment le moins mauvais. »
Son D-Day à lui, les alliés en moins. « C'est une folie, vous n'êtes pas préparés », pianote un ami. «
Dissoudre, pourquoi pas, mais ça s'anticipe », écrit un autre. A quelques pas d'Alexis Kohler, le chef de l'Etat,
fier et grave, profite-t-il des silences pour calculer les sièges de la majorité en cas de législatives anticipées ?
INTÉRIEUR JOUR LE TOUQUET DIMANCHE 9 JUIN
Dans un dossier, les notes reçues au cours des dernières quarante-huit heures, plusieurs scénarios sont
proposés : un référendum, la proportionnelle aux législatives... « Changer le mode de scrutin, ça faisait très
Page 120 of 198 © 2025 Factiva, Inc. Tous droits réservés.
magouille », dira plus tard un de ses conseillers. Plus l'heure de flancher. Dans quelques minutes, le chef
annoncera sa décision de dissoudre l'Assemblée nationale. Fidèle à lui-même, il tente encore de convaincre
ceux qui avouent leurs doutes : « C'est maintenant ou jamais. »
Aux plus inquiets, qui l'alertent sur l'affaiblissement de son pouvoir et le risque de tout abîmer, à commencer
par son legs, il répond : « Je crois tout l'inverse ! L'acte de dissolution est un acte de protection du pouvoir du
président de la République. » Face à « la chienlit », comme disait le plus fameux de ses prédécesseurs,
l'absolue nécessité de dépressuriser. « Qu'ils viennent me chercher », fanfaronnait Emmanuel Macron en
2018. Le matador est devenu taureau : et s'ils réussissaient à le trouver ? Alors, plutôt la cohabitation que la
succession : épuiser le RN à l'épreuve du pouvoir, convaincre ces « Français en colère » de l'inanité du
projet lepéniste, pour se rassurer : « Je ne donnerai pas les clés de cette maison à l'extrême droite en 2027.
» L'Elysée dans ses derniers retranchements.
INTÉRIEUR NUIT ÉLYSÉE DIMANCHE 9 JUIN
La bombe est lâchée, l'heure n'est plus au doute. Et pourtant. Comment peut-on se tromper à ce point ? Fin
mai, Emmanuel Macron est en visite d'Etat en Allemagne, il assure à ceux qui l'accompagnent : « On va faire
plus de 20 %. » Dans les jours qui précèdent le scrutin, parce que c'est là que le vote se cristallise : « C'est
encore à portée de faire un bon 20 %. » Et sinon, et si c'est encore moins que ce qu'annoncent les sondages
? « Alors là, il y a un très gros problème », lâche le président. Comment peut-on se tromper à ce point ?
Après : il a décidé de dissoudre, et aussi de choisir le délai le plus court pour convoquer les électeurs. « La
gauche, je lui souhaite bien du courage pour s'unir », lance-t-il. Le 9 au soir. Le 10, un de ses proches insiste
: « La Nupes sans Mélenchon, je demande à voir. »
EXTÉRIEUR SUR LES ONDES MARDI 11 JUIN
Le chef de l'Etat, sur le terrain de la politique intérieure, dispose d'une autre arme nucléaire que la
dissolution. Celle-là ne figure pas dans la Constitution, c'est le départ soudain de l'Elysée. Le 13 mars 1986,
dans l'après-midi, Le Monde titre à la Une : « M. Mitterrand n'écarterait pas l'éventualité d'une démission ».
Des élections législatives sont prévues dans trois jours. La manoeuvre est limpide : dramatiser, susciter la
peur.
C'est exactement la même chose, sauf que c'est le contraire. Mardi matin, Europe 1 affirme qu'Emmanuel
Macron pourrait « mettre sa démission dans l'équation ». L'Elysée se demande qui a téléguidé l'article, se
précipite pour démentir. Si les Français savent que leur vote aux législatives peut leur permettre de renvoyer
le président, ils risquent de ne pas hésiter... Surtout tuer dans l'oeuf cette idée. Le lendemain, lors de sa
conférence de presse, puis le 13 juin, en Italie, Emmanuel Macron le répète : il est là jusqu'en 2027. La
menace de la démission est une arme fatale qui peut se retourner contre son auteur. Il sait, qui plus est, que
démissionner ne lui permettrait pas de se représenter dans la foulée, un de ses proches a appelé cette
semaine un constitutionnaliste pour s'en assurer.
EXTÉRIEUR/INTÉRIEUR PARTOUT LES JOURS D'APRÈS...
« Est-ce que toi aussi tu penses que c'était une folie ? » Le message dit la panique. Il émane d'un intime du
président et son destinataire, quand il le reçoit, se trouve bien embarrassé. Pointer l'impréparation ?
L'absence de dialogue entamé avec la droite, l'absence de contact noué avec la gauche ? En début de
semaine, un ami d'Emmanuel Macron a échangé avec Raphaël Glucksmann. La tête de liste des socialistes
se sent prise au piège des partis, contrainte de s'allier avec La France insoumise, et regrette l'absence de
main tendue venant de l'Elysée. Son interlocuteur croit ne pas se tromper, c'est bien de la rancoeur
qu'éprouve l'essayiste à l'encontre du chef de l'Etat. La dissolution est censée donner un avantage décisif à
celui qui la déclenche, or le Palais n'a pas anticipé, il bricole, il n'a plus de projet. Le Palais n'est pas prêt. De
la dissolution, Emmanuel Macron a-t-il prévenu Emmanuel Macron ?
L'heure est grave, François Bayrou a réinstallé sur son ordinateur le logiciel qui depuis des années fait sa
fierté. Il permettrait de jauger les résultats dans chacune des 577 circonscriptions. Les projections qu'il
découvre le 13 juin annoncent 300 députés pour le Rassemblement national, une majorité absolue, donc ; de
185 à 190 sièges pour le Nouveau Front populaire et entre 70 et 90 maigres députés pour la majorité
présidentielle. Ne pas crier au loup. Dix-huit jours de campagne et autant de possibilités de rebonds.
D'ailleurs, Marine Le Pen a fait passer le message au Château : « Si j'ai 240 députés, je n'accepterai pas le
pouvoir. »
ÉPILOGUE
Cinq jours ont passé depuis le séisme. Avant, il faisait tout, le voulait, s'en vantait. Dimanche encore, lundi
encore, il avait son programme en tête : moi, moi et moi. Mais voilà qu'on tente, tant bien que mal, de lui faire
passer un message. Moins il en ferait, mieux ce serait. Macron au rabais. Il tient quand même une
conférence de presse mercredi ? « Il vient de nous bouffer deux heures de temps de parole », claque un
ancien ministre. Macron condamné au silence, qui cherche un sursis. « Ça ne m'a pas fait plaisir, je l'ai pris
Page 121 of 198 © 2025 Factiva, Inc. Tous droits réservés.
pour moi, ça m'a touché », dit-il jeudi. Macron aux abois. Fini pour l'heure , les grandes prises de parole,
place au symbolique, à l'emblématique. Subliminal, forcément subliminal. Ce n'est plus Jupiter, c'est « Jupi
qui se terre ». Un ancien collaborateur de l'Elysée rédige l'épitaphe : « On peut avoir été le salut un jour et le
problème le lendemain, c'est ça, la politique. » Dans le silence du crépuscule, ne résonne qu'un rire, celui
d'Emmanuel Macron, forcément, quand il lance à un conseiller : « Tu m'as mis un beau bordel depuis
dimanche ! »
Document EXPRSS0020240620ek6k0000b
"
EXPRSS,20/06/2024,"Page 116 of 198 © 2025 Factiva, Inc. Tous droits réservés.
News; En couverture
En couverture - Le mystificateur Corps constitués; Des préfets rendont leur casquette
MARYLOU MAGAL ALEXANDRA SAVIANA
1,541 mots
20 juin 2024
L'Express
EXPRSS
24
3807
Français
Copyright 2024 L'Express - All rights reserved
La possibilité de voir le parti d'extrême droite exercer pour la première fois le pouvoir inquiète la haute
fonction publique. Mais pas toute.
Mars 2024, près de l'Assemblée nationale. Laure Lavalette, députée RN du Var, est entourée d'une brochette
de journalistes . « C'est sûr que si on arrive au pouvoir, certains hauts fonctionnaires seront sous
antidépresseurs », s'esclaffe-t-elle. Il y a trois mois seulement, personne encore n'imagine que la possibilité
pour le parti d'extrême droite d'arriver aux responsabilités est si proche. Elle-même n'a pas que de bonnes
expériences avec les hauts fonctionnaires, notamment avec Philippe Mahé, le préfet du Var, qui refuse de
s'afficher aux côtés de la députée frontiste. Le 7 décembre 2023, il ne l'avait pas invitée à l'inauguration d'une
maison France services dans sa circonscription, comme lors d'un déplacement à Porquerolles en compagnie
du ministre Hervé Berville, où Laure Lavalette avait fait des pieds et des mains pour tenter de s'incruster. Si
des préfets se sont faits à la présence du RN à l'Assemblée, les relations ne sont pas encore fluides sur tout
le territoire. Du moins, elles ne l'étaient pas jusqu'au 9 juin au soir, au moment où Emmanuel Macron a choisi
de dissoudre l'Assemblée.
Jusqu'alors, l'arrivée au pouvoir du RN n'était qu'une hypothèse, qu'on évoquait au détour des conversations.
Désormais la perspective de voir s'installer Jordan Bardella à Matignon est devenue une vraie possibilité.
Depuis, les téléphones sonnent sans arrêt. « Beaucoup de hauts fonctionnaires m'appellent pour être
conseillés, explique Nathalie Loiseau, eurodéputée Horizons et ex-directrice de l'Ecole nationale
d'administration (ENA), de 2012 à 2017. Ils se questionnent, car le RN n'est évidemment par un parti comme
les autres. » Au sommet de l'Etat, on consulte à tout-va ses aînés. « Un préfet de région m'a encore appelé
tout à l'heure, confirme un fonctionnaire d'expérience. Par le passé, il a été dans le cabinet d'un ministre
socialiste et ne se fait aucune illusion sur son avenir dans cette hypothèse. Servir un gouvernement de cette
nature ne l'enthousiasme pas. » Les états d'âme sont grands chez les préfets, de loin les fonctionnaires les
plus exposés à cet éventuel changement de l'exécutif. Placés sous l'autorité de Beauvau, ils devront, si le RN
arrive au pouvoir, appliquer directement ses décisions en matière sécuritaire. Un autre préfet, de
département cette fois, renchérit : « Un certain nombre d'entre nous rendront la casquette, c'est certain. Il est
inimaginable que je salue Jordan Bardella en uniforme ! » Un ancien préfet, exerçant désormais d'autres
responsabilités au sein de l'Etat, approuve vivement. « Je suis dans ce cas aussi, et je n'en ai jamais fait
mystère. Les hauts fonctionnaires de mon entourage se posent la question personne n'a envie de servir un
exécutif à la main du Rassemblement national, explique-t-il. Mais les gens se demandent évidemment ce
qu'ils pourront faire ensuite. Beaucoup ont des enfants et un prêt à rembourser. »
Nombreux sont ceux qui font le choix de se tourner vers d'autres administrations, plus indépendantes et donc
moins exposées. « Certains me disent qu'ils vont partir à la Cour des comptes ou au Conseil d'Etat pour se
protéger, et ont d'ailleurs déjà déposé des candidatures », indique un jeune haut fonctionnaire à la direction
générale du Trésor. Marqué à gauche, il juge « impossible » d'appliquer les décisions budgétaires d'un
gouvernement estampillé RN. Mais ce n'est pas le cas de tous. « Mes camarades sont globalement hostiles à
leur arrivée, mais il ne faut pas oublier qu'au Trésor, généralement, tout le monde est assez économiquement
libéral, poursuit-il. Ils se disent que, malgré les annonces du RN, leur arrivée au pouvoir sera business as
usual. » Et si ça ne l'est pas ?
« Ils se rassurent en se convainquant qu'ils font de la statistique et que leur activité n'est pas politique.
Pourquoi s'en soucieraient-ils ? »
Pour nombre d'observateurs, plutôt qu'une fronde, cet état d'esprit prévaudrait chez la majorité des hauts
fonctionnaires en cas d'arrivée au pouvoir du Rassemblement national. « Quand François Mitterrand gagne
en 1981, le pouvoir socialiste était perçu comme quasi bolchevique. Vous savez combien de personnes ont
quitté la préfectorale ? Une seule, un sous-préfet. Il s'appelait Philippe de Villiers, pointe Jean-Jacques
Page 117 of 198 © 2025 Factiva, Inc. Tous droits réservés.
Urvoas, garde des Sceaux sous François Hollande. La hiérarchie pensera à son futur et attendra que la
période passe. » Le RN n'a donc pas à craindre de démissions en masse au sommet de l'Etat. Chez les plus
hostiles au parti d'extrême droite, on préfère s'imaginer être un barrage à toute dérive de l'Etat de droit. « Je
serai là pour tenir la maison », confie un conseiller d'Etat. D'autres se perçoivent carrément comme une «
résistance de l'intérieur ». « Vous savez, quand l'Administration peut freiner un projet, elle sait très bien le
faire, ajoute une magistrate de la Cour des comptes. Il n'y a quasiment pas de loi qui passe aujourd'hui sans
décret d'application, et il n'y a rien de plus facile que de traîner la patte à ce moment-là. » De hauts
fonctionnaires mués en Che Guevara par leur force d'inertie. « J'appelle ça de la déloyauté, tance le préfet
qui envisage de rendre sa casquette. Cette stratégie ne fera que renforcer le ressentiment du public. Et c'est
sans compter sur les hauts fonctionnaires en accord avec les idées du RN. »
Depuis peu, on sent dans les couloirs des corps constitués un changement d'atmosphère. Ainsi ce jour où,
dans une réunion de la Cour des comptes, un participant a défendu l'idée de recruter plutôt des personnes
d'origine modeste mais françaises à la place d'immigrés. Ou ce haut fonctionnaire qui a entendu échapper un
propos raciste dans un couloir. « Je n'avais jamais vu ça en quarante ans, s'offusque-t-il auprès de
L'Express. Le fond de l'air est brun. On sent qu'il n'y a plus de diabolisation, la question n'est pas ""le fascisme
est à nos portes"", c'est comment on vit avec. »
De quoi relativiser le changement qu'induirait l'arrivée de Bardella à Matignon. « Je pense que peu de gens
sont sensibles au passé du Rassemblement national aujourd'hui, de la même manière que peu relient le Parti
communiste aux staliniens. C'est une transformation inévitable », estime Daniel Keller, exprésident de
l'Association des anciens élèves de l'ENA, qui appelle malgré tout à faire barrage au RN. Ce n'est pas le cas
de tous. Un ressentiment sourd, lié notamment à la réforme de la haute fonction publique lancée par
Emmanuel Macron, en pousse quelques-uns, au Quai d'Orsay, à affirmer vouloir voter pour l'extrême droite.
« Je fais partie des gens qui sont remontés comme des pendules et qui se disent : j'ai très mal vécu cette
réforme, je vais voter Marine Le Pen », confie un diplomate. Le texte entré en application en 2021 avait
notamment signé la fin du corps diplomatique. « Je ne suis pas le seul à penser comme ça, assure-t-il. Après
tout, si le RN arrive au pouvoir par un biais démocratique, pourquoi ne pas essayer ? »
Du côté du parti d'extrême droite, on le jure : « Nous n'aurons aucun mal à trouver de hauts fonctionnaires
désireux de se mettre à notre service. » Depuis les années 1980, quelques préfets, sous-préfets et énarques,
d'Yvan Blot à Jean-Yves Le Gallou, en passant par Christophe Bay (directeur de campagne de Marine Le
Pen pendant la présidentielle de 2022), ont toujours gravité autour du parti lepéniste. L'entourage de la
patronne cite sans cesse les Horaces, ce cercle obscur de conseillers, issus pour certains de la haute
fonction publique, qui conseille Marine Le Pen.
Pour les élections législatives à venir, d'ailleurs, on trouve parmi les candidats investis par le RN un ancien
de l'administration centrale de Bercy, ou des militaires. « Il existe déjà un degré d'adhésion énorme chez
certains, peste un membre de la Cour des comptes. Les militaires sont tout simplement ravis, les flics sont
contents, et les préfets, pour beaucoup, ne sont pas fâchés. » Côté frontiste, on abonde. Thomas Ménagé,
député du Loiret, assure que, sur son territoire, il a reçu plusieurs invitations à dîner de hauts fonctionnaires
membres de la Cour des comptes. Le député trentenaire y voit là un glissement générationnel, lié aussi à
l'évolution sociologique du parti. « Les anciens, on ne les aura pas, mais les nouveaux, les administrateurs
de l'Assemblée, les juges administratifs, on les connaît, on a fait nos études avec eux, on se croise. Le RN
est désormais plus populaire et plus hétérogène, ça facilite les relations avec ce genre de profils. » Pas
d'inquiétude, donc. Et certains attendent même qu'une accession au pouvoir règle leurs problèmes d'entente
avec les préfets de leur territoire, qui devraient être remplacés par des volontaires moins hostiles.
Document EXPRSS0020240620ek6k0001h
"
EXPRSS,20/06/2024,"Page 118 of 198 © 2025 Factiva, Inc. Tous droits réservés.
News; L'OEIL DE L'EXPRESS
L'OEIL DE L'EXPRESS; Emmanuel Macron refait le coup des EPR
SÉBASTIEN JULIAN
423 mots
20 juin 2024
L'Express
EXPRSS
12
3807
Français
Copyright 2024 L'Express - All rights reserved
Comme en 2022, le président défend la construction de nouveaux réacteurs à l'approche d'un scrutin.
La France doit-elle construire six nouveaux EPR ou bien 14 ? Pour le ministre de l'Economie et de l'Industrie,
Bruno Le Maire, la réponse paraît évidente : même si notre pays a besoin d'investir énormément dans ses
capacités de production d'électricité on parle de 30 nouveaux réacteurs classiques nécessaires d'ici à 2050
pour maintenir un parc digne de ce nom, qui tiendrait compte du vieillissement avancé de nombreuses
centrales , il faut rester réaliste. EDF, dans sa situation actuelle, aura bien des difficultés à construire les six
premiers EPR.
Le patron de Bercy soulignait il y a quelques jours à peine « l'ampleur gigantesque » du chantier à venir, «
dans une filière qui malheureusement a connu des hauts et des bas, a été trop souvent pointée du doigt, qui
a perdu beaucoup de compétences et qui doit maintenant se reconstruire ». Mais ce discours semble trop
pessimiste pour Emmanuel Macron. Lors de sa conférence de presse du 12 juin, le chef de l'Etat a réitéré
son objectif d'arriver à 14 EPR. Une décision « forte », indispensable pour la transition écologique. Le
président aurait-il des informations sur l'état de la filière que son ministre n'a pas ?
Que nenni. « Cette annonce, plus tactique qu'autre chose, passe volontairement sous silence les nombreux
défis auxquels EDF fait face en termes de main-d'oeuvre, de ressources financières et de délais. Il est
évident qu'il s'agit principalement d'une stratégie de campagne dans le contexte difficile des élections
législatives anticipées, car la question de la relance du parc nucléaire national reste très populaire auprès
de la majorité des électeurs », estime Franck Gbaguidi, directeur du développement durable au cabinet
d'études Eurasia Group.
En coulisses, nombre d'experts continuent d'ailleurs de s'interroger sur la fibre nucléaire du président. « Je lui
reprocherai toujours de ne pas avoir empêché la fermeture de Fessenheim, privant ainsi la France, pour des
raisons idéologiques, d'un réacteur de forte puissance alors qu'il pouvait encore fonctionner, moyennant
quelques investissements », souligne l'un d'entre eux. « En tout cas, lors de la présidentielle de 2022,
Emmanuel Macron avait déjà fait le coup d'annoncer de nouveaux EPR », remarque Franck Gbaguidi. La
ficelle est un peu grosse, mais dans le chaos politique actuel, toute voix est bonne à prendre.
Document EXPRSS0020240620ek6k0001l
"
