nom_journal,date,contenu
FIGARO,19/06/2024,"Page 139 of 198 © 2025 Factiva, Inc. Tous droits réservés.
FIGARO ECONOMIE Entreprises
La Bourse de Paris détrônée par celle de Londres
Danièle Guinot; dguinot@lefigaro.fr
1,148 mots
19 juin 2024
Le Figaro
FIGARO
A
23
24827
Français
(c) Copyright 2024 Le Figaro.
Paris vient de perdre sa couronne de première place boursière européenne. Son attractivité pourrait pâtir de
l'instabilité politique.
C'est l'une des conséquences de l'instabilité politique qui secoue la France depuis l'annonce de la dissolution
de l'Assemblée nationale le 9 juin. Paris vient de perdre sa couronne de première place boursière
européenne. Elle est détrônée par Londres, qu'elle avait doublé début 2023, après avoir temporairement pris
une première fois la tête en novembre 2022. 
Le coup de tabac de la semaine dernière à la Bourse de Paris a rebattu les cartes. En cinq séances, la place
a perdu plus de 240 milliards d'euros de capitalisation boursière. Le CAC 40 a décroché de plus de 6 %,
enregistrant sa pire performance hebdomadaire depuis mars 2022 au tout début de l'invasion russe de
l'Ukraine. L'indice, qui était au plus haut de son histoire il y a un mois à peine, a effacé en une semaine ses
gains depuis le début de l'année. Les petites valeurs n'ont pas été épargnées (le CAC Mid & Small a perdu
25 milliards d'euros). «   Les petites entreprises ont souvent une activité basée en France, elles sont donc
plus vulnérables à l'évolution de l'économie ou de la fiscalité française , explique Emmanuel Cau, analyste
chez Barclays. Dans l'ensemble, la semaine dernière, les investisseurs ont vendu les actions françaises de
façon indéterminée craignant que les programmes des partis donnés en tête des sondages leur soient moins
favorables. Mais on n'a pas vu de mouvement de panique.   »
Résultat, lundi à la clôture, le total de la valeur des entreprises cotées dans la capitale française est tombé à
3 136 milliards de dollars, contre 3 178 milliards de dollars pour Londres, dont les cours ont peu bougé ces
derniers jours, calcule l'agence Bloomberg . «   Après une période considérable d'investissements dans les
limbes, il y a des signes croissants que le Royaume-Uni regagne les faveurs d'investisseurs étrangers »,
pointe Richard Hunter, analyste chez Interactive Investors. Si la Bourse de Paris a quelque peu retrouvé des
couleurs depuis le début de la semaine (+ 0,76 % mardi), il ne s'agit que d'une «   faible reprise » , souligne
Susannah Streeter, analyste chez Hargreaves Lansdown. Et elle pourrait ne pas durer. Car la place tricolore
a perdu de son attrait aux yeux des investisseurs internationaux. «   La France est devenue le marché
d'actions européen le plus mal-aimé des investisseurs » , relèvent les stratèges de Bank of America (BofA)
après avoir sondé les gestionnaires d'actifs la semaine dernière. Ce qui tranche singulièrement avec
l'enquête réalisée en mai, lorsque la France était le premier choix de ces mêmes investisseurs.
L'issue incertaine des élections
Les élections législatives pourraient mener à l'arrivée au gouvernement du Rassemblement national, en
tête dans les sondages, ou bien de membres de l'alliance de gauche Nouveau Front populaire. Mais les
programmes politiques des deux camps effraient les investisseurs, qui craignent notamment un creusement
des déficits publics, à cause de la baisse de la TVA proposée par le RN et de l'abrogation de la réforme des
retraites voulue par la gauche (et par le RN à l'automne). L'issue incertaine des élections et la possibilité
d'une absence de majorité absolue à l'issue du scrutin du 7 juillet, qui rendrait le pays difficilement
gouvernable, risquent de porter un coup à l'attractivité de la place financière tricolore dans son ensemble.
Jusqu'à présent, Paris est l'une des grandes gagnantes du Brexit.
Depuis 2021 et l'entrée en vigueur du divorce entre la Grande-Bretagne et l'Union européenne, un grand
nombre de banquiers d'affaires et de traders, dont les activités ne peuvent plus être réalisées depuis Londres
faute de passeport européen, s'y sont installés. Les grandes banques américaines (JP Morgan, Morgan
Stanley, Bank of America, Goldman Sachs...) ont été les premières à transférer leurs troupes dans la
capitale. Elles ont été suivies par les grands hedge funds, des fonds de capital-investissement et des
gestionnaires d'actifs. En quelques années, 7 000 emplois directs et indirects ont ainsi été créés en France,
Page 140 of 198 © 2025 Factiva, Inc. Tous droits réservés.
principalement en Île-de-France. Soit bien plus que dans les autres grandes places du Vieux Continent
également sur les rangs pour attirer les financiers de la City. 
La France avait su trouver les arguments pour renforcer son attractivité. «   Un cap a été franchi avec l'arrivée
d'Emmanuel Macron au pouvoir et la mise en place de réformes du travail et fiscales » , assurait il y a
quelques mois un banquier. Les impôts des entreprises ont été globalement allégés, tandis que le régime
fiscal avantageux pour les salariés impatriés a été rallongé. Le gouvernement est depuis allé plus loin. Le
5 juin, le Parlement a adopté la loi visant à accroître le financement des entreprises et l'attractivité de la
France. Elle a été promulguée dans l'urgence le 13 juin par le président de la République. Son objectif est
notamment de faciliter le financement des entreprises européennes en rendant la Bourse de Paris plus
compétitive (plafonnement des indemnités de licenciement des traders, facilitation des introductions en
Bourse...). Mais est-ce que cela sera suffisant pour retenir les financiers en cas changement de majorité à
l'Assemblée ? «   À court terme, il ne devrait pas y avoir de changement, car les forces de la place de Paris
n'ont pas subitement disparu et les décisions de relocalisation d'activités sont lourdes à prendre , avance un
banquier d'affaires. Mais, on va entrer dans une période d'attentisme.   » À plus long terme, des nuages
apparaissent. «   L'effet Macron, c'est-à-dire le président pro business, avait joué en faveur de Paris et séduit
les grands patrons de banques américaines , avance un analyste. L'effort de séduction des financiers risque
d'être remis en question.   »
« Il est possible que la France ne soit plus aussi attractive après les élections , en particulier si le pays reste
instable sur le plan politique, abonde Emmanuel Cau. En fonction des résultats, beaucoup de questions vont
se poser. Il pourrait y avoir des changements d'ordre fiscal ou sur la politique migratoire. Les banques
anglo-saxonnes voudront être sûres de pouvoir continuer à attirer des talents du monde entier.   »  
D'autres villes du Vieux Continent sont déjà sur les rangs pour accueillir les financiers : Milan et Madrid, par
exemple se sont récemment dotées d'avantages fiscaux alléchants. Francfort, siège de la BCE, pourrait aussi
avoir une carte à jouer même si jusqu'à présent, les banquiers et traders ont montré peu d'appétence pour la
capitale régionale allemande. Et Londres n'a pas dit son dernier mot pour retenir les activités pouvant être
réalisées depuis la Grande-Bretagne.  D. G.
1072.0.1661483542
Document FIGARO0020240619ek6j0001o
"
FIGARO,19/06/2024,"Page 134 of 198 © 2025 Factiva, Inc. Tous droits réservés.
LE FIGARO Société
L'autonomie de la Corse victime de la dissolution de l'Assemblée
Antoine Giannini; agiannini@lefigaro.fr
891 mots
19 juin 2024
Le Figaro
FIGARO
A
10
24827
Français
(c) Copyright 2024 Le Figaro.
La décision d'Emmanuel Macron a fait voler en éclats la perspective de ce processus, entériné par un accord
avec le gouvernement en février.
Conférence de presse d'Emmanuel Macron, dans la foulée de la dissolution de l'Assemblée nationale. Un
journaliste interroge le président de la République sur le devenir des sujets chauds, dont le processus
d'autonomie de la Corse. Le pensionnaire de l'Élysée répond sur tout, sauf sur la question politique insulaire.
Une scène qui en dit long sur l'état de ce dossier, à présent très éloigné des priorités du gouvernement.
D'aucuns n'hésitent pas à parler d'un «  processus enterré vivant  ». Si la dissolution décidée par le président
de la République a fait l'effet d'une bombe dans le pays, elle a aussi mis KO les élus nationalistes en Corse.
Gérald Darmanin, le ministre de l'Intérieur, s'était engagé en mars 2022 à discuter de l'avenir de l'île, jusqu'à
une potentielle autonomie, quatre mois après l'agression mortelle en prison du militant indépendantiste corse
Yvan Colonna, condamné à perpétuité pour l'assassinat du préfet Claude Érignac. De violentes
manifestations avaient alors éclaté dans l'île. Emmanuel Macron avait aussi acté cette réforme
constitutionnelle, en septembre 2023, devant l'Assemblée de Corse.
Plus de deux ans après ces discussions « historiques » et laborieuses, les élus nationalistes espéraient
conclure les échanges, après un accord avec le ministre de l'Intérieur, Gérald Darmanin, en février 2024, sur
« un statut d'autonomie au sein de la République ». Le texte, qui prévoyait notamment un statut pour l'île,
devait tenir compte de «  ses intérêts propres liés à son insularité méditerranéenne, à sa communauté
historique, linguistique, culturelle, ayant développé un lien singulier à sa terre  ». Mais aussi de la disposition
selon laquelle la collectivité de Corse «  peut être habilitée à fixer les normes dans les matières où s'exercent
ses compétences  ».
Plusieurs obstacles, et non des moindres, restaient à franchir. Un vote au Sénat, à l'Assemblée nationale et
un passage au Congrès en fin d'année, sur fond d'hostilités de nombreux élus de droite. «  Nous avions
réussi à aller très loin dans les discussions et la dissolution a tout mis par terre, constate, amer, Paul-André
Colombani, député nationaliste (Parti de la nation corse) de Corse du Sud. Personne ne peut dire ce qu'il va
advenir. Je suis très inquiet si le Rassemblement national arrive en tête lors des législatives.   »
« Rendez-vous manqué »
Et pour cause. Le parti de Marine Le Pen, qui a remporté les élections européennes, est fortement opposé à
l'autonomie de la Corse. Dans les colonnes de Corse-Matin , le 5 juin, Jordan Bardella redoutait que cette
réforme constitutionnelle constitue le «  marchepied de l'indépendance  ».
Dans l'île, le parti à la flamme a réalisé carton plein, bien au-dessus de son score au niveau national, soit
10 points de plus. La liste soutenue par Emmanuel Macron (13,2 %) est arrivée loin derrière alors que
l'abstention a été importante (57 %). Un résultat qui fait tâche par rapport aux discussions sur l'autonomie.
D'autant plus que l'attitude de Gilles Simeoni, à l'occasion de ce scrutin, n'a pas été vue d'un bon oeil à Paris.
Le président de la région a fait le choix de ne passer aucune consigne de vote : «  L'attitude de Gilles
Simeoni suffit à enterrer ce processus, confie François-Xavier Ceccoli, président de la fédération Les
Républicains de Haute-Corse. Il ne s'agissait pas d'appeler à voter pour Macron mais d'appeler à ne pas
voter pour les partis opposés au processus.   »
Celui qui est candidat à un poste de député se montre très pessimiste sur l'avenir de l'autonomie : «  Vu les
difficultés et les obstacles rencontrés par le processus, je suis très pessimiste pour la suite. C'est un
rendez-vous manqué dont les Corses vont souffrir. En particulier sur le plan financier. Il y avait la possibilité
d'avoir des moyens économiques supplémentaires pour l'île. Quel que soit le résultat des élections
Page 135 of 198 © 2025 Factiva, Inc. Tous droits réservés.
législatives au niveau national, je ne vois pas ce qui pourrait relancer les discussions. Avant la fin du
mandat, il n'y aura rien. Le problème corse passera à la fin du livre.   »
Alors que ces échanges avaient mis fin aux violences qui avaient touché l'île après la mort d'Yvan Colonna,
d'autres s'inquiètent d'une reprise des tensions en Corse. «   Ce processus avait ramené le calme dans l'île,
analyse Paul-André Colombani. La société corse peut très vite se remettre en tension. Il y a cette crainte.
Nous allons reprendre notre bâton de pèlerin mais la fenêtre de tir au niveau du calendrier est de plus en plus
petite.   »
Les législatives pourraient aussi définitivement mettre un coup d'arrêt aux discussions, en cas de défaite des
nationalistes, qui comptent trois députés. «  Cette étape est un sondage politique qu'on n'a pas eu tout au
long de ce processus  », reconnaît l'autonomiste. François-Xavier Ceccoli, lui, est plus tranché : « Personne
ne me parle d'autonomie sur le terrain. Cette question intéresse les politiciens mais les simples citoyens sont
loin de tout ça. » A.G.
1072.0.1658536933
Document FIGARO0020240619ek6j00025
"
FIGARO,19/06/2024,"Page 147 of 198 © 2025 Factiva, Inc. Tous droits réservés.
LE FIGARO Politique
Législatives : le scénario à haut risque d'une As  semblée ingouvernable
Clara Hidalgo; chidalgo@lefigaro.fr
1,125 mots
19 juin 2024
Le Figaro
FIGARO
A
2
24827
Français
(c) Copyright 2024 Le Figaro.
Si aucune majorité absolue ne se dégage au soir du second tour des élections, le 7 juillet prochain, le pays
pourrait plonger dans une crise politique majeure.
C'est un scénario dont personne ne veut vraiment parler tant ses conséquences relèvent encore de l'inconnu.
Que se passerait-il si aucune majorité absolue ne se dégageait dans les urnes, au soir du 7 juillet prochain ?
«   Ce serait un beau bordel... La séquence politique ne se dénouera pas dans l'année » , souffle une cadre
socialiste. Les premiers sondages n'écartent pas totalement la possibilité d'une Assemblée nationale
« ingouvernable », où aucune force politique ne parviendrait à décrocher les 289 sièges sur 577
indispensables pour détenir une majorité absolue. 
Le premier ministre doit, en pratique, émaner du camp majoritaire pour permettre à son gouvernement de
faire passer ses textes de loi à l'Assemblée nationale. Sans cela, il est exposé à la menace permanente de la
motion de censure qui, si elle est adoptée par les oppositions, conduit à sa démission. «   Le nouveau
gouvernement pourrait donc tomber au bout d'une semaine », prédit Benjamin Morel, maître de conférences
en droit public à Paris Panthéon-Assas. Une configuration incertaine qui plongerait le pays dans une «   crise
de régime », a mis en garde le ministre de l'Économie, Bruno Le Maire.
Promis à Matignon en cas de victoire de son camp, Jordan Bardella a déjà prévenu qu'il déclinerait ce
cadeau empoisonné. «   Pour gouverner, j'ai besoin d'une majorité absolue », a-t-il balayé ce lundi dans un
entretien au Parisien . Sans laquelle Marine Le Pen et son dauphin refuseraient de former un gouvernement,
obligeant le chef de l'État à bâtir une majorité ailleurs. La gauche unie sous la bannière du Nouveau Front
populaire, pas écartée de la course, évite de se poser la question, préférant se concentrer sur une campagne
«   difficile ». «   En politique, il faut savoir avaler les plats les uns après les autres », professe Patrick Kanner,
patron des sénateurs socialistes.
Pour anticiper les blocages, une majorité relative peut toujours faire l'appoint avec des élus d'opposition.
C'est ce qu'a tenté le camp présidentiel, fragilisé par une majorité relative à partir de 2022, en négociant des
alliances de circonstance. Mais les troupes d'Emmanuel Macron n'ont jamais réussi à constituer une coalition
durable, au-delà de la stratégie du «   texte par texte ». Faute de solides alliés, l'exécutif a dû passer en force
à vingt-trois reprises avec l'article 49.3, lui permettant de faire adopter un texte sans vote. Et s'exposant en
retour à autant de motions de censure, dont l'une d'entre elles a manqué de le renverser, en mars dernier, à
neuf voix près.
L'exercice d'équilibriste risque d'être encore plus complexe pour le RN ou le Nouveau Front populaire, s'ils
détiennent une courte majorité. Le premier ne pourrait compter que sur d'éventuels députés issus de son
« alliance » avec LR, décrétée par le patron contesté du parti, Éric Ciotti. Le second ne pourrait trouver le
potentiel soutien que d'une poignée de macronistes de gauche, rescapés des urnes. Même si le parti
présidentiel conservait sa majorité relative, Emmanuel Macron aurait lui aussi du mal à conjuguer avec ces
deux blocs irréconciliables. Il y a quelques jours, le chef de l'État a tendu la main aux sociaux-démocrates,
écologistes ou démocrates-chrétiens pour construire une «   fédération de projets » au lendemain du scrutin.
«   Il n'arrivera pas à débaucher des socialistes. L'aile droite du PS ne cédera pas parce que la présidentielle
est trop proche », tranche une élue socialiste.
Surtout, le nouveau gouvernement devra affronter un premier obstacle : le vote à haut risque du projet de loi
de finances 2025, prévu à l'automne. Le contexte économique est particulièrement inflammable, alors que les
comptes publics plongent dans le rouge. «   Le gros danger, c'est qu'en cas de pression des marchés, le
budget devrait être relativement contraint », avertit Benjamin Morel. Ce qui contraindrait le Nouveau Front
populaire comme le RN, critiqués pour leurs programmes économiques, à faire machine arrière sur plusieurs
mesures jugées trop coûteuses.
Page 148 of 198 © 2025 Factiva, Inc. Tous droits réservés.
Dans un scénario de majorité relative, l'exécutif tout juste formé échapperait difficilement à l'option de l'article
49.3, au risque d'être aussitôt renversé par une motion de censure. Comme les textes financiers doivent
impérativement être appliqués dès le 1 er  janvier 2025, la Constitution offre une ultime porte de sortie,
rarement empruntée : celle de l'article 47, qui prévoit une adoption du budget par ordonnance en cas de
blocage parlementaire. «   Cela peut permettre de renvoyer le vote très loin, on peut traîner pendant des mois
», décrypte Benjamin Morel. Même avec ce délai supplémentaire, les deux Chambres devront tôt ou tard
s'exprimer sur le projet de loi. Là encore, resurgit le spectre d'une censure du gouvernement.
Même l'hypothèse d'une démission d'Emmanuel Macron - écartée par l'intéressé - ne débloquerait pas cette
paralysie institutionnelle. «   Ce n'est pas vraiment une sortie de crise, balaie Benjamin Morel. Le problème,
ce n'est pas lui, mais l'absence de majorité dans la Chambre.   » Un nouveau président ne peut dissoudre
l'Assemblée nationale, et donc convoquer de nouvelles élections législatives, deux fois dans la même
année, comme l'impose l'article 12. Dans un entretien au Figaro , Marine Le Pen a pourtant jugé que la
Constitution ne laisserait à Emmanuel Macron que le «   seul choix » de démissionner en cas de «   blocage
total » de la machine démocratique.
En attendant, une seule solution semble envisageable aux yeux des constitutionnalistes pour contourner
l'absence de majorité absolue. Celle de la nomination d'un gouvernement de «   techniciens » , inspiré du
modèle italien. «   Le principe est de nommer un vieux sage comme premier ministre. Un homme ou une
femme politique qui ne déplaît à personne, capable de créer une alliance allant de l'extrême droite à
l'extrême gauche. Sa mission serait de diriger le gouvernement jusqu'aux nouvelles élections législatives »,
avance Benjamin Morel. En 2012, l'Italie, alors enlisée dans une crise politique, confie les rênes à Mario
Monti, ancien commissaire européen à la Concurrence, chargé uniquement de gérer les affaires courantes. «
  En France, on pourrait s'attendre à voir le centriste  Charles de Courson  à ce poste   », évoque le
politologue, citant le nom du député le plus expérimenté de l'Assemblée nationale, respecté de tous les bords
pour sa connaissance fine des finances publiques. Interrogé par Le Figaro , l'intéressé, en campagne pour
son huitième mandat, ne ferme pas la porte : «   On verra après... À chaque jour suffit sa peine. » C.G. ET C.
H.
1072.0.1661188123
Document FIGARO0020240619ek6j00009
"
