nom_journal,date,contenu
FIGARO,12/06/2024,"Page 9 of 52 © 2025 Factiva, Inc. Tous droits réservés.
LE FIGARO Débats
« Dans l'histoire, les «Fronts populaires» n'ont jamais très bien fini »
Ronan Planchon; ronan.planchon@gmail.com
1,266 mots
12 juin 2024
Le Figaro
FIGARO
A
16
24821
Français
(c) Copyright 2024 Le Figaro.
Pour le cofondateur de SOS-Racisme et ancien député socialiste, l'alliance nouée entre les différentes
formations de gauche en vue des prochaines élections législatives est une faute politique et morale,
compte tenu des prises de position et du programme de LFI.
Que répondez-vous à ceux qui affirment qu'une alliance est la seule façon pour la gauche de faire obstacle à
l'arrivée du Rassemblement national au pouvoir ?
D'abord, il faut arrêter les comparaisons historiques qui n'ont pas lieu d'être. La France n'est pas en 1933.
Les Français qui ont voté pour le Rassemblement national ont voté pour l'extrême droite, c'est grave et cela
suffit en soi de le dire. Ces gens-là traduisent une profonde colère qui s'est installée dans le pays et à
laquelle, pour l'instant, personne n'a su répondre sérieusement. Il y a donc un immense ras-le-bol et une
envie de renverser la table.
Cette colère, ce n'est pas simplement une colère sociale, c'est aussi une colère contre un État impuissant,
tant en matière de lutte contre la montée des violences et du banditisme, menteur sur la maîtrise des flux
migratoires, incapable de reconquérir les territoires perdus de la République. Dire cela, ce n'est pas trahir la
gauche, mais au contraire la représenter. Car les premiers qui souffrent de ces situations-là sont d'abord
ceux qui n'ont pas les moyens de se protéger. La gauche à laquelle je crois, c'est celle qui se bat pour le droit
à la sécurité pour tous, partout, et qui ne crie pas bêtement : « La police tue ». La gauche à laquelle je crois,
ce n'est pas celle qui considère que les frontières ouvertes à tout-va, c'est formidable. D'autant que cette libre
circulation sert, surtout, à faire baisser le coût de la main-d'oeuvre des travailleurs.
Il s'est passé quelque chose autour de la candidature de Raphaël Glucksmann, et cela peut se prolonger
dans les urnes dans les semaines à venir. Nous sommes entrés dans une phase d'accélération de l'histoire
et tout est encore possible, à condition de respecter les engagements pris devant les électeurs.
Que pensez-vous de la référence au Front populaire, formé en vue des élections législatives de 1936 ?
Je n'aime pas l'appellation « Front populaire ». Dans l'histoire, les « Fronts populaires » n'ont jamais très bien
fini. Ma référence, c'est celle du Conseil national de la résistance et de son programme. La bataille à mener,
ce n'est pas de dire : « Halte au fascisme », mais de rassembler tous les Français en leur redonnant espoir
dans la République, ses valeurs et son contenu et surtout son action au service de tous.
Pour la gauche, la bataille à mener ne peut pas être qu'une bataille sociale, car dans le vote aux
européennes, il y a aussi évidemment des questions de violence, d'insécurité, de maîtrise sérieuses des flux
migratoires et de lutte contre la ghettoïsation. J'ajoute que la gauche doit aussi être capable de défendre la
nation, les frontières, comme a su le faire Jaurès en son temps. Si la gauche se contente, comme d'habitude,
de considérer qu'il suffit simplement de faire du social et d'oublier toutes ces questions régaliennes, elle ne
pourra pas reconquérir l'électorat populaire, et par exemple les « gilets jaunes ».
Nous sommes entrés dans une phase où il faut tendre la main, par-delà les étiquettes politiques. Cette
grande alliance ne doit pas s'articuler autour de formations politiques qui sont aujourd'hui discréditées, mais
sur un programme concret. Ça ne doit pas être un catalogue de revendications qu'on se dépêchera d'oublier
une fois arrivés au pouvoir. La gauche doit dire qu'elle veut remettre l'école sur pied, expliquer qu'il n'y aura
plus de territoire perdu de la République, et faire que le système judiciaire prononce de réelles sanctions en
cas de faute, et les applique. Il faut un « Conseil de la résistance » pour rétablir l'ordre juste dans la société
française.
Page 10 of 52 © 2025 Factiva, Inc. Tous droits réservés.
La gauche peut-elle reconquérir l'électorat parti au RN sans s'attaquer à la question de l'immigration ? Quels
sont selon vous les principes auxquels la gauche ne peut renoncer, même en cas d'alliance ?
Il y a d'énormes réserves de voix lors de ces législatives, notamment chez les abstentionnistes et ceux qui
vont hésiter face au RN. Mais on ne peut pas user que de ce ressort-là, comme l'a fait Emmanuel Macron
lors de la dernière présidentielle. Il faut permettre aux Français de ne plus voter « contre » mais « pour ».
Pour une école qui fonctionne, où le respect du professeur (re)devient une règle de base. Et pour la défense
des services publics, comme les hôpitaux, en arrêtant de les étrangler budgétairement parlant. Il faut
défendre une réforme fiscale qui rétablisse une véritable justice et ne pénalise pas, voire rackette, le travail et
ceux qui vivent de leur travail et de leur création. Il faut en finir avec une administration tatillonne qui
empoisonne la vie des plus modestes au quotidien.
Par ailleurs, la gauche doit être d'une clarté absolue sur trois points. Premièrement, la confiance dans la
construction européenne. Deuxièmement, la défense de l'Ukraine face à l'agression de Poutine.
Troisièmement, la création d'un État palestinien, mais qui passe aussi par la reconnaissance du droit à la
sécurité pour l'État d'Israël. Ces éléments ne sont pas négociables.
LE FIGARO. - Les partis de gauche (Les Écologistes, les Insoumis, le Parti communiste et le PS, Place
publique et Génération.s) se sont mis d'accord lundi soir sur le principe d'un «   nouveau «Front populaire»  
»   et des «   candidatures uniques dès le premier tour   » aux élections législatives anticipées du 30 juin et
du 7 juillet. Quel regard portez-vous sur cette union ?
JULIEN DRAY. - La question, c'est moins celle de l'alignement de sigles de partis que celle du contenu de
l'accord entre ces partis. Lundi soir, Raphaël Glucksmann a fixé des lignes rouges qui sont les bonnes et qui
sont infranchissables. L'accord se fera-t-il autour de ces lignes rouges ou est-ce que cet accord sera encore
une fois une capitulation sur la ligne de La France insoumise, et donc une trahison par rapport à la dernière
campagne électorale ? Aucun accord n'est possible avec LFI, qui serait une concession à programme
politique.L'attaque du Hamas contre Israël, le 7 octobre, a marqué l'aboutissement d'une évolution politique
de Jean-Luc Mélenchon. Le leader des Insoumis considère désormais que les prolétaires blancs sont acquis
au Rassemblement national et s'est tourné donc vers ce qu'il appelle «   la nouvelle France » , en
essentialisant et en enfermant ainsi dans un ghetto les populations des quartiers populaires et en fermant les
yeux sur la réalité de ce que sont le Hamas ou le Hezbollah par exemple. Je lui rappelle juste que c'était
Lionel Jospin qui avait courageusement désigné le Hezbollah comme mouvement terroriste.Jean-Luc
Mélenchon, qui était le spécialiste de la laïcité, est devenu le spécialiste des communautés. Il tourne ainsi le
dos à ce qui était l'essence de ses combats passés : il prône désormais le droit à la ressemblance et non le
droit à la différence. Ce qui conduirait à la fragmentation de la société française et la montée des tensions
communautaires.
1072.0.1525832921
Document FIGARO0020240612ek6c0000u
"
FIGARO,12/06/2024,"Page 13 of 52 © 2025 Factiva, Inc. Tous droits réservés.
LE FIGARO Politique
Programme, circonscriptions... après l'accord de principe à gauche, le plus dur commence
Pierre Lepelletier; plepelletier@lefigaro.fr
1,366 mots
12 juin 2024
Le Figaro
FIGARO
A
6
24821
Français
(c) Copyright 2024 Le Figaro.
Répartition des circonscriptions, programme et choix de la personnalité pour prétendre au poste de premier
ministre... Les négociations battent leur plein à gauche pour confirmer le rassemblement promis.
Croix de bois, croix de fer, les socialistes le promettaient : s'allier avec Jean-Luc Mélenchon, plus jamais !
C'est pourtant précisément ce que le PS et le reste de la gauche ont acté lundi soir en s'accordant sur le
principe d'un « nouveau Front populaire ». Pour tenter d'éviter le pire début juillet, avec une potentielle
victoire du RN aux élections législatives anticipées, les principaux partis ont fait en vingt-quatre heures
table rase de mois et de mois de tensions. «   Comme au lendemain de la présidentielle de 2022 je l'avais
proposé, je le répète : il faut jeter la rancune à la rivière ! Sinon quoi ? La vendetta sans fin ? Il faut chercher
sans cesse le moyen d'avancer », a écrit Jean-Luc Mélenchon sur son blog lundi. La veille, l'Insoumis
ironisait encore sur ces «   méchantes langues qui, tout d'un coup, se ravisent des horreurs qu'elles ont pu
dire auparavant et qui se demandent comment faire ».  Voilà tout ce petit monde de retour autour d'une
même table. 
Une première fumée blanche s'est échappée lundi soir, depuis le siège des Écologistes où les principaux
responsables de gauche s'étaient enfermés depuis des heures. Alors que la nuit venait de tomber sur Paris,
tous sont allés annoncer la bonne nouvelle aux nombreux militants qui occupaient la rue des Petits-Hôtels
(10 e ). «   Nous l'avons fait. Nous sommes tombés d'accord sur le fait de travailler à des candidatures
uniques dans toutes les circonscriptions », annonçait Marine Tondelier, la secrétaire nationale des
Écologistes. «   Nous avions la volonté de partir ensemble dans cette bataille pour proposer une alternative à
la politique d'Emmanuel Macron et combattre l'extrême droite raciste », a ajouté Manuel Bompard, le
coordinateur national de LFI. 
Si un léger espoir renaît chez les électeurs de gauche, le plus dur reste malgré tout à faire. Les discussions
se sont poursuivies toute la journée de mardi. Au coeur des débats : le projet commun, bien sûr, mais aussi
l'épineuse répartition des circonscriptions ainsi que le choix de la personnalité pour porter la campagne. Les
Insoumis n'ont pas eu le culot de ressortir du placard les affiches «   Mélenchon premier ministre » de
l'alliance de la Nupes. Dès dimanche soir, socialistes, écologistes et communistes avaient prévenu qu'ils ne «
  s'aligneraient » plus derrière le chef de LFI tant il serait, à leurs yeux, devenu le «   pire » candidat pour
représenter la gauche. Lancé par Raphaël Glucksmann au « 20 Heures » de France 2 lundi soir, le ballon
d'essai pour propulser Laurent Berger a également été immédiatement dégonflé. L'ancien secrétaire général
de la CFDT n'a même pas donné suite... 
Mais l'essentiel est ailleurs. Au pied du mur, ces artisans du « nouveau Front populaire » vont surtout devoir
regagner en crédibilité pour convaincre les Français. Comment expliquer qu'ils sont aujourd'hui d'accord sur
quasiment tout après avoir conclu qu'ils ne l'étaient sur presque plus rien ? Ces derniers mois, à l'occasion de
la campagne des élections européennes, les divergences ont été exposées au grand jour. Sur le volet
international, les socialistes, les écologistes et les communistes n'ont par exemple cessé de reprocher aux
Insoumis de ne pas avoir qualifié le Hamas d' «   organisation terroriste » après l'attaque du 7 octobre en
Israël. À l'inverse, Rima Hassan, nouvelle eurodéputée LFI, répétait que les socialistes appartenaient à une «
  gauche coloniale » pour ne pas utiliser le terme de «   génocide » à l'encontre du peuple gazaoui.
Même sujet pour le retour à la retraite à 60 ans. Totem de LFI, avalé par le reste de la gauche en position de
faiblesse lors de l'accord de la Nupes après le désastre de la présidentielle, la mesure n'a pas été soutenue
par Raphaël Glucksmann lors des européennes. «   Ce ne sera pas 60 ans de façon universelle  », avait
tranché la tête de liste des socialistes mi-mai sur France 3. Mais dès lundi matin, Olivier Faure semblait
pourtant la recycler. «   Je suis favorable à ce que l'âge légal soit de 60 ans pour l'ensemble des Français » ,
a assuré le premier secrétaire du PS, prévenant cependant que «   la durée de cotisation » ne sera «   pas la
Page 14 of 52 © 2025 Factiva, Inc. Tous droits réservés.
même pour tout le monde » . Funambulesque. Les discussions devaient donc aboutir sur un compromis où
aucun parti ne devait donner le sentiment... de se compromettre.
Se tenait en parallèle l'ardente négociation pour la répartition des circonscriptions. L'exercice, toujours
périlleux, est généralement sans surprise : comme au poker, seuls les plus stratèges tirent leur épingle du
jeu. Très vite, Jean-Luc Mélenchon et les siens se sont fixés comme mission de déjouer la tentation du reste
de la gauche de les «   cornériser ». Avant même le scrutin européen, socialistes, écologistes, communistes
et même quelques frondeurs LFI - François Ruffin en première ligne - planchaient déjà sur une nouvelle
union, à distance du noyau dur mélenchoniste, dans la perspective de 2027. 
Dès le début des négociations, la petite délégation Insoumise, proche du chef, a donc mis une proposition
sur la table. L'idée : acter le nouveau rapport de force en faisant la somme des voix de chaque candidat de
gauche à l'élection présidentielle de 2022 avec celles de chaque liste de gauche aux dernières européennes.
Sur le papier, ce scénario permettrait aux Insoumis de conserver leur leadership (plus de dix millions de voix
cumulées, quatre millions pour le PS, trois millions pour les Verts, un peu plus de 1 million pour le PCF). De
quoi franchement agacer les négociateurs socialistes qui ne veulent pas s'abaisser à des «   calculs
d'apothicaire » . «   Nous demandons pour notre part une discussion sur la réalité territoriale des
circonscriptions et des personnalités en présence capable de battre l'extrême droite » , rapporte un cadre
socialiste au coeur des négociations. Comprendre : mieux vaut une candidature PS que LFI dans les
circonscriptions où le risque d'une victoire du RN est élevé.
Autre point en cours de discussion mardi : la protection, et donc la reconduction automatique, ou non, des
quelque 151 députés de l'ex-intergroupe de la Nupes. Quelques situations tendues posent question. Par
exemple, que faire du cas d'Adrien Quatennens, député LFI de la 1 re  circonscription du Nord, qui avait
reconnu avoir donné une «   gifle » à son ex-épouse, en septembre 2022 ? À l'époque, le reste de la gauche
avait dénoncé la mauvaise gestion de l'affaire par les Insoumis qui n'avaient pas exclu leur ancien
coordinateur national, très proche de Jean-Luc Mélenchon. «   La question de son investiture se pose » ,
prévenait dès dimanche soir la députée écologiste Sandrine Rousseau sur BFMTV. «   Ça va être un sujet » ,
confirmait un des négociateurs mardi en fin d'après-midi.
En parallèle des négociations, la direction socialiste devait gérer un autre front mardi soir. Le conseil national
du parti se réunissait au siège, à Ivry-sur-Seine (Val-de-Marne), et un certain nombre d'opposants à Olivier
Faure, hostiles à une alliance avec LFI, comptaient bien se faire entendre. En amont, ils déploraient que le
premier secrétaire n'ait pas davantage profité de la dynamique enclenchée par Raphaël Glucksmann
(13,83 %) pour constituer une nouvelle force-pivot à gauche. «   C'était une chance pour la gauche, et donc
pour la France... » , regrette un élu socialiste. 
Principal adversaire interne, Nicolas Mayer-Rossignol refusait, lui, une candidature unique de la gauche dans
chaque circonscription, défendant plutôt des «   accords techniques » là où le risque d'une victoire RN est
fort. Le maire de Rouen souhaite par exemple que des candidats socialistes se présentent à Paris face aux
députés sortants Insoumis, telles Sophia Chikirou, Danièle Obono ou Danielle Simonnet. Gage rassurant
pour la direction : Carole Delga, une des principales opposantes d'Olivier Faure, a elle dit «   oui » à un «  «
Front populaire» ouvert et le plus large possible   », bien qu'elle rappelle n'avoir «   jamais cédé ni aux
sirènes macronistes ni aux sirènes mélenchonistes » . P.L.
1072.0.1527288092
Document FIGARO0020240612ek6c0001b
"
FIGARO,12/06/2024,"Page 5 of 52 © 2025 Factiva, Inc. Tous droits réservés.
LE FIGARO Société
Paris 2024 : les Jeux olympiques percutés par les élections législatives
Célestine Gentilhomme; cgentilhomme@lefigaro.fr
1,075 mots
12 juin 2024
Le Figaro
FIGARO
A
8
24821
Français
(c) Copyright 2024 Le Figaro.
Alors que le RN pourrait se retrouver en première ligne lors des JO, l'organisation ne devrait pas en être
perturbée.
Ce devait être l'une des seules bouffées d'oxygène du second quinquennat d'Emmanuel Macron. Mais
l'annonce surprise, dimanche soir par le chef de l'État, d'une dissolution de l'Assemblée nationale vient
percuter les Jeux olympiques et paralympiques (JOP) dans la toute dernière ligne droite. La fenêtre de tir est
plus qu'étroite : les Français sont appelés aux urnes pour choisir leurs 577 députés les 30 juin et 7 juillet
prochains, quand l'événement sportif doit commencer le 24 juillet avec de premières épreuves, avant la
cérémonie d'ouverture, prévue le 26 juillet.
Éclipsés par l'agenda électoral, les Jeux de Paris pourraient être surtout bouleversés par la composition d'un
nouveau gouvernement, selon les résultats des élections législatives, quelques jours avant le coup d'envoi.
Le scénario d'une cohabitation - en cas de déroute du camp Macron et de nouveau triomphe du
Rassemblement national, déjà auréolé d'une victoire écrasante aux européennes - pousserait
mécaniquement vers la sortie les ministres concernés par l'échéance olympique : le ministre de l'Intérieur,
Gérald Darmanin, chargé de la sécurité de l'événement, et la ministre des Sports, Amélie Oudéa-Castéra.
Jordan Bardella, lui, serait promu au poste de premier ministre. Ce qui le projetterait immédiatement en
première ligne, aux côtés du chef de l'État, lors de la cérémonie d'ouverture sur la Seine.
Alors que les yeux du monde entier seront rivés sur l'Hexagone, les troupes macronistes en ont déjà fait un
argument de campagne. «   Il y a une question à se poser, c'est quelle image veut-on projeter dans le monde
? Les Français sont conduits à se demander qui ils veulent pour diriger le pays et ils sont également conduits
à se demander qui ils veulent pour accueillir le monde » , a lancé lundi Amélie Oudéa-Castéra, en marge
d'une visite dans une école parisienne. Au micro de France Inter le même jour, le ministre des Affaires
étrangères, Stéphane Séjourné, a surenchéri : «   Je ne veux pas que Jordan Bardella accueille les
délégations internationales lors des JO. »
Au RN, le sujet des Jeux est évidemment au centre des attentions de Marine Le Pen et de Jordan Bardella.
Les deux figures nationalistes savent qu'ils vont devoir gérer ce dossier complexe au débotté s'ils gagnent les
législatives et que le second arrive à Matignon. «   La continuité de l'État sera assurée » , veut croire un
cadre RN.
Depuis Châtenay-Malabry (Hauts-de-Seine), où elle inaugurait ce mardi un centre de formation de jeunes
sportifs, la présidente LR de la région Île-de-France, Valérie Pécresse, a appelé à une «   trêve olympique »
pour éviter que l'événement ne soit «   otage de la politique » . «   J'espère que les Jeux pourront être tenus à
l'écart de toutes les turbulences politiques qui pourraient arriver dans le pays » , a expliqué l'ex-candidate à la
présidentielle. La veille, la maire socialiste de Paris, Anne Hidalgo, a quant à elle tenté de dissiper les
doutes : «   Les Jeux se feront dans une très belle ambiance et rien ne viendra les gâcher. » Même si celle-ci
a reconnu qu' «   une dissolution juste avant les JO » était «   extrêmement troublante » .
Au sein du Comité d'organisation (Cojo), on se montre imperturbables, sûrs de la qualité du travail accompli.
Qu'un éventuel remaniement gouvernemental et un changement de ministre des Sports ne viendraient pas
bouleverser. «   Nous sommes prêts à livrer les Jeux » , affirme ainsi avec force le Cojo par le biais d'un
communiqué. «   L'État est évidemment un acteur clé mais nous savons que nous pourrons compter sur sa
mobilisation ainsi que celle des services, même dans le contexte de ces élections anticipées, pour faire
avancer les derniers sujets. Nous avons déjà démontré notre capacité collective à faire avancer notre projet
même dans des contextes électoraux (il y a eu déjà douze élections organisées depuis la phase de
candidature). »
Page 6 of 52 © 2025 Factiva, Inc. Tous droits réservés.
Une assurance partagée lundi matin par le président du Comité international olympique (CIO), Thomas Bach,
alors qu'il visitait une école à Paris : «   Il s'agit d'un processus démocratique qui ne va pas perturber les
Jeux. Nous voyons une grande unité en faveur des Jeux olympiques de Paris 2024. On sent l'enthousiasme
qui est évident ici. La France est habituée à faire des élections et va le faire encore une fois. On aura un
nouveau Parlement et un nouveau gouvernement et tout le monde va supporter les Jeux olympiques. »
Présent à ses côtés, Tony Estanguet, le patron du Cojo, ne pouvait qu'abonder dans son sens : «   On a déjà
fait face à des adaptations qui ont été fortes et on a toujours su travailler avec les acteurs publics. Les
principales décisions ont toutes été prises, on est vraiment dans l'opérationnalité de chacune de ces
décisions. »
Ce dernier ajoutait alors : «   Notre mission est de réussir ces Jeux, de montrer le meilleur de la France, de
célébrer les valeurs olympiques auxquelles on est très attachés depuis le début : le respect, l'amitié,
l'excellence, la diversité et l'inclusion qui nous tiennent à coeur et que l'on va mettre à l'honneur pendant ces
Jeux » . Autrement dit, le train Paris 2024 avance sur des rails extrêmement solides, et rien ne pourra l'en
écarter.
Idem du côté des sportifs, qui entament la dernière phase de leur préparation, dont l'état d'esprit se
résumerait ainsi, selon un membre du Comité national olympique sportif et français (CNOSF), préférant
conserver l'anonymat : «   Personne ne se réjouit du résultat de dimanche, et aucun d'entre eux n'aimerait
recevoir des félicitations cet été de la part d'un ou d'une ministre des Sports représentant le Rassemblement
national. Maintenant, ils savent faire la part des choses et ils ont tous à coeur de briller pour la France, pour
leurs proches, pour eux-mêmes, et certainement pas pour un gouvernement X ou Y. Donc je ne crois pas
qu'ils seront perturbés, si ce n'est qu'ils vont devoir inclure dans leur agenda de devoir voter le 30 juin et le 7
juillet, pour certains par procuration car ils seront en stage loin de leur bureau de vote, en France ou à
l'étranger. » C. C. ET C.G.
1072.0.1526945948
Document FIGARO0020240612ek6c0001e
"
